group_id,sentence_id,sentence_type,sentence_content_en,translated_sentence,note,words_contained_dict
7,1,academic,"Over the past decade, intellectual discourse surrounding historical philosophy has undergone significant transformation. Scholars assert that appropriate understanding of ancient texts requires us to locate and negotiate their original context, contrary to modern interpretations. As mature academic disciplines emerge, they often impose new methodologies that can strain traditional approaches. This has led some researchers to forecast a breakdown in conventional analytical frameworks, while others endure these changes as necessary evolution in academic thought.",過去10年間、歴史哲学に関する知的議論は大きな変革を遂げてきました。学者たちは、古代のテキストを適切に理解するためには、現代の解釈とは反対に、それらの原典の文脈を特定し理解する必要があると主張しています。学問分野が成熟するにつれて、しばしば新しい方法論が導入され、それが従来のアプローチに負担をかけることがあります。これにより、一部の研究者は従来の分析の枠組みの崩壊を予測する一方で、他の研究者たちはこれらの変化を学術的思考における必要な進化として耐え忍んでいます。,,"{""1173"": ""appropriate"", ""1177"": ""impose"", ""1178"": ""strain"", ""1180"": ""strain"", ""1182"": ""contrary"", ""1185"": ""locate"", ""1186"": ""mature"", ""1187"": ""negotiate"", ""1188"": ""philosophy"", ""1189"": ""assert"", ""1191"": ""breakdown"", ""1192"": ""decade"", ""1194"": ""endure"", ""1198"": ""emerge"", ""1199"": ""forecast"", ""1200"": ""historical"", ""1201"": ""intellectual""}"
7,2,conversation,"Hey, did you hear about Tom? He had to sacrifice his weekend plans to shelter some stray dogs that bit his neighbor's kid. The neighbor showed mercy though and didn't press charges.",ねぇ、トムのこと聞いた？近所の子供を噛んだ野良犬を保護するために週末の予定を犠牲にしなきゃならなかったんだって。でも近所の人が慈悲深くて、告訴はしなかったみたいだけど。,友人同士の日常的な会話,"{""1178"": ""mercy"", ""1195"": ""sacrifice"", ""1196"": ""shelter"", ""1197"": ""bite""}"
7,3,free,"The young scientist managed to dissolve the complex compound, which led to her being awarded a prestigious grant. Despite the enjoyment she found in her research, she had to conquer several disadvantages, including limited resources and interference from competing labs.",若き科学者は複雑な化合物を溶解することに成功し、その功績により権威ある助成金を授与されました。研究に喜びを見出していたものの、限られた資源や競合する研究室からの妨害など、いくつかの不利な状況を克服しなければなりませんでした。,,"{""1174"": ""award"", ""1175"": ""conquer"", ""1183"": ""dissolve"", ""1184"": ""enjoyment"", ""1193"": ""disadvantage"", ""1202"": ""interfere""}"
7,4,academic,"Recent studies in environmental science assume a steady decline in biodiversity, with researchers developing an intricate plot to map species distribution. Those apt at analyzing complex data patterns have noted that contrary to popular belief, some ecosystems are showing remarkable resilience when given appropriate protection measures.",環境科学における最近の研究では、生物多様性の着実な減少が想定されており、研究者たちは種の分布を図示するための緻密な計画を立てています。複雑なデータパターンの分析に長けた研究者たちは、一般的な認識とは反対に、適切な保護措置が講じられた場合、一部の生態系が顕著な回復力を示していることを指摘しています。,,"{""1173"": ""appropriate"", ""1176"": ""decline"", ""1179"": ""plot"", ""1181"": ""apt"", ""1182"": ""contrary"", ""1190"": ""assume""}"
7,5,academic,"Recent research on racial minorities has revealed a challenging crisis in educational provision. The burden of academic achievement gaps continues to menace social progress, and isolated communities often face utterly different circumstances. While promising initiatives have emerged, the consensus among researchers remains disputed. A rational approach to addressing these disparities requires both abstract theoretical frameworks and practical contributions. Consequently, many institutions have renewed their commitment to inclusive education, though inflation in educational costs poses an additional obstacle.",人種的マイノリティに関する最近の研究は、教育提供における困難な危機を明らかにしています。学力格差の重荷は社会の進歩を脅かし続けており、孤立したコミュニティはしばしば全く異なる状況に直面しています。有望な取り組みが現れている一方で、研究者間のコンセンサスは議論の的となっています。これらの格差に対処する合理的なアプローチには、抽象的な理論的枠組みと実践的な貢献の両方が必要です。結果として、多くの機関が包括的な教育への取り組みを新たにしていますが、教育費用のインフレーションが追加の障害となっています。,,"{""1205"": ""abstract"", ""1206"": ""burden"", ""1208"": ""contribution"", ""1210"": ""minority"", ""1212"": ""challenging"", ""1213"": ""crisis"", ""1218"": ""promising"", ""1219"": ""provision"", ""1221"": ""consensus"", ""1222"": ""consequently"", ""1223"": ""inflation"", ""1224"": ""renew"", ""1226"": ""utterly"", ""1227"": ""dispute"", ""1228"": ""isolated"", ""1229"": ""menace"", ""1230"": ""racial"", ""1231"": ""rational""}"
7,6,conversation,"Hey, did you see that bug in my code? It's making all my test results scatter across the screen!",ねぇ、私のコードのバグに気付いた？テスト結果が画面中に散らばってるの！,プログラマー同士の会話,"{""1203"": ""scatter"", ""1220"": ""bug""}"
7,7,free,"The volunteer session at the local food bank was particularly memorable. As I helped peel vegetables, I watched the sparkle in children's eyes as they helped prepare the recipe. Their innocent enthusiasm made the work feel less like a burden and more like a celebration.",地域のフードバンクでのボランティアセッションは特に印象的でした。野菜の皮をむくのを手伝いながら、子供たちがレシピの準備を手伝う時の目の輝きを見ていました。彼らの無邪気な熱意のおかげで、作業は重荷というよりもお祝いのように感じられました。,,"{""1204"": ""volunteer"", ""1206"": ""burden"", ""1209"": ""innocent"", ""1211"": ""session"", ""1216"": ""peel"", ""1225"": ""sparkle"", ""1232"": ""recipe""}"
7,8,conversation,I'm about to plunge into my new job near the city center! The column I'll be writing for the newspaper looks really promising!,市の中心部の近くで新しい仕事に飛び込もうとしてるの！新聞のコラムを書くんだけど、すごく有望そう！,新しい仕事を始める人の興奮した会話,"{""1207"": ""column"", ""1215"": ""near"", ""1217"": ""plunge"", ""1218"": ""promising""}"
7,9,conversation,"Don't let them see you! Quick, put on this disguise!",見つからないようにして！早く、この変装をして！,友人同士の遊び心のある会話,"{""1214"": ""disguise""}"
7,10,academic,"The unemployment rate continues to soar in developing economies, presenting an acute challenge for policymakers. Recent studies show that workers with inferior skills often struggle to cope with the rapid technological expansion, while those with superior qualifications maintain a dominant position in the job market. Federal agencies have undertaken comprehensive research to understand this phenomenon, with a particular objective of addressing the increasing frequency of long-term unemployment. The profile of the modern workforce has undergone significant changes, forcing many to become accustomed to constant upskilling.",発展途上国における失業率は上昇を続けており、政策立案者にとって深刻な課題となっています。最近の研究によると、スキルの劣る労働者は急速な技術拡大への対応に苦戦する一方、優れた資格を持つ者は労働市場で支配的な地位を維持しています。連邦機関は、特に長期失業の増加する頻度に対処することを目的として、この現象を理解するための包括的な研究に着手しています。現代の労働力の特性は大きく変化しており、多くの人々が継続的なスキルアップに慣れることを余儀なくされています。,,"{""1233"": ""soar"", ""1234"": ""unemployment"", ""1235"": ""acute"", ""1236"": ""inferior"", ""1237"": ""profile"", ""1239"": ""superior"", ""1240"": ""undergo"", ""1241"": ""undertake"", ""1242"": ""accustomed"", ""1244"": ""dominant"", ""1245"": ""expansion"", ""1252"": ""cope"", ""1254"": ""frequency"", ""1257"": ""objective"", ""1259"": ""federal""}"
7,11,conversation,"Hey, did you hear about Mike and Sarah's divorce? It's ridiculous how they're fighting over their cereal company. The heir to the business is getting all suspicious about the alliance with their competitors.",ねぇ、マイクとサラの離婚について聞いた？彼らがシリアル会社のことで争ってるの、馬鹿げてるわ。事業の相続人が競合他社との提携について疑り深くなってるみたい。,友人同士の噂話の場面,"{""1247"": ""ridiculous"", ""1249"": ""suspicious"", ""1250"": ""alliance"", ""1253"": ""divorce"", ""1256"": ""heir"", ""1258"": ""cereal""}"
7,12,free,"In the dim light of the ancient temple, passionate believers gathered to protect their sacred artifacts. The myth about these objects had startled researchers, who were trying to furnish evidence of their historical significance. A colleague from the museum gave me a warm hug as we discovered new inscriptions.",古代寺院の薄暗い光の中、熱心な信者たちが彼らの神聖な遺物を守るために集まっていた。これらの物についての神話は研究者たちを驚かせ、彼らはその歴史的重要性の証拠を提供しようとしていた。博物館の同僚は、私たちが新しい碑文を発見したとき、温かく抱きしめてくれた。,,"{""1238"": ""sacred"", ""1243"": ""dim"", ""1246"": ""passionate"", ""1248"": ""startle"", ""1251"": ""colleague"", ""1255"": ""furnish"", ""1260"": ""hug"", ""1262"": ""myth""}"
7,13,conversation,"Eww, did you see that dog lick its owner's face? That's so gross!",うわぁ、あの犬が飼い主の顔をペロペロしてるの見た？超気持ち悪い！,友人との日常的な会話,"{""1261"": ""lick""}"
7,14,academic,"Contemporary conservation efforts have become increasingly crucial in protecting endangered species. The concept of environmental preservation has gained prominent attention, with multiple studies stimulating public interest. Thoughtful researchers portray the continuous decline of natural habitats as a serious threat, while their patent findings restrict industrial activities in protected areas. The consumption of natural resources has reached an alarming rate, leading provincial governments to vow stricter regulations. Spectators of this environmental crisis can no longer remain neutral, as the effects are visible to the naked eye.",現代の環境保護活動は、絶滅危惧種の保護においてますます重要になってきています。環境保全の概念は注目を集め、多くの研究が公共の関心を刺激しています。思慮深い研究者たちは、自然habitat の継続的な減少を深刻な脅威として描き、彼らの特許を取得した研究結果は保護地域での産業活動を制限しています。天然資源の消費は警戒すべき水準に達し、地方政府はより厳格な規制を誓約しています。この環境危機の観察者はもはや中立的な立場を保てず、その影響は肉眼でも確認できます。,,"{""1263"": ""stimulate"", ""1264"": ""thoughtful"", ""1265"": ""vow"", ""1266"": ""concept"", ""1267"": ""conservation"", ""1269"": ""portray"", ""1270"": ""prominent"", ""1271"": ""provincial"", ""1272"": ""restrict"", ""1273"": ""spectator"", ""1274"": ""crucial"", ""1277"": ""patent"", ""1279"": ""contemporary"", ""1282"": ""multiple"", ""1283"": ""naked eye"", ""1284"": ""neutral"", ""1289"": ""consumption"", ""1290"": ""continuous""}"
7,15,conversation,"Hey, did you see that daring stunt at the festival? The fire blaze was unexpectedly huge! I didn't dare get any closer!",ねぇ、フェスティバルであの大胆なスタント見た？火の炎が予想外に大きかったよ！これ以上近づく勇気なかったよ！,若者同士のフェスティバルでの会話,"{""1278"": ""blaze"", ""1287"": ""unexpectedly"", ""1291"": ""dare"", ""1292"": ""daring""}"
7,16,free,"The genuine craftsman would grind the sand into a horizontal pattern, filling the brim of each ceramic piece. His work would dispose of any imperfections, creating masterpieces fit for the throne room.",本物の職人は砂を水平なパターンに粉砕し、それぞれの陶器の縁まで埋めていきました。彼の作業はあらゆる不完全さを取り除き、玉座の間にふさわしい傑作を生み出しました。,,"{""1268"": ""horizontal"", ""1275"": ""grind"", ""1280"": ""dispose"", ""1281"": ""genuine"", ""1285"": ""sand"", ""1286"": ""throne"", ""1288"": ""brim""}"
7,17,conversation,You should really heed the warning about that patent medicine. I've heard multiple people say it's not genuine.,その特許薬の警告は本当に注意を払うべきだよ。多くの人が本物じゃないって言ってるの聞いたよ。,友人同士の健康に関する会話,"{""1276"": ""heed"", ""1277"": ""patent"", ""1281"": ""genuine"", ""1282"": ""multiple""}"
7,18,academic,"Recent archaeological expeditions in Central America have uncovered abundant evidence of ancient maize cultivation, challenging our outlook on pre-Columbian agriculture. The sphere of influence of these agricultural practices was far more extensive than previously conceived. While seemingly elementary farming techniques were employed, the architecture of storage facilities and irrigation systems was remarkably advanced. These findings have led researchers to inspect and recruit local experts to help convey the significance of these discoveries. What's particularly noticeable is how these civilizations, though largely illiterate, developed complex agricultural units that continue to influence modern farming methods.",中央アメリカでの最近の考古学的探検により、古代のトウモロコシ栽培に関する豊富な証拠が発見され、先コロンブス期の農業に対する我々の見方に異議を唱えています。これらの農業実践の影響範囲は、以前に考えられていたよりもはるかに広範でした。一見すると初歩的な農業技術が使用されていたものの、貯蔵施設や灌漑システムの建築様式は驚くほど進歩的でした。これらの発見により、研究者たちは地域の専門家を調査し、採用して、これらの発見の重要性を伝えることを助けてもらっています。特に注目すべきは、これらの文明が大部分は非識字者であったにもかかわらず、現代の農業方法に影響を与え続けている複雑な農業単位を発展させたことです。,,"{""1293"": ""expedition"", ""1294"": ""illiterate"", ""1295"": ""outlook"", ""1296"": ""sphere"", ""1298"": ""elementary"", ""1300"": ""maize"", ""1305"": ""unit"", ""1308"": ""conceive"", ""1309"": ""convey"", ""1310"": ""elementary"", ""1313"": ""seemingly"", ""1314"": ""architecture"", ""1316"": ""inspect"", ""1317"": ""noticeable"", ""1319"": ""recruit"", ""1322"": ""abundant""}"
7,19,conversation,"Hey, did you hear that loud roar from the lab? Poor Sarah couldn't stop sneezing while doing that cautious inspection of the new specimens!",ねえ、研究室からあの大きな轟音聞いた？かわいそうなサラが新しい標本を慎重に検査してる時に、くしゃみが止まらなくなっちゃったんだって！,研究室での会話。同僚について話している場面。,"{""1307"": ""cautious"", ""1316"": ""inspect"", ""1320"": ""roar"", ""1321"": ""sneeze""}"
7,20,academic,"The legend of the lost city has persisted through generations, tempting numerous explorers to undertake dangerous expeditions. Recent studies in the linguistic sphere have revealed that many proverbs from the region, both in singular and plural forms, contain references to this mythical place. While some scholars remain cautious about drawing conclusions, the confusion surrounding these ancient texts might stem from omitting crucial contextual details that could gleam through careful analysis.",失われた都市の伝説は何世代にもわたって続き、多くの探検家が危険な探検に挑戦する誘惑となってきました。言語学分野での最近の研究により、この地域の多くの諺が、単数形でも複数形でも、この神話的な場所への言及を含んでいることが明らかになりました。一部の学者は結論を出すことに慎重な姿勢を保っていますが、これらの古代テキストを取り巻く混乱は、慎重な分析を通じて輝きを放つ可能性のある重要な文脈の詳細を省略していることに起因している可能性があります。,,"{""1293"": ""expedition"", ""1296"": ""sphere"", ""1297"": ""tempt"", ""1299"": ""legend"", ""1301"": ""plural"", ""1302"": ""proverb"", ""1303"": ""singular"", ""1307"": ""cautious"", ""1311"": ""gleam"", ""1312"": ""omit"", ""1315"": ""confusion""}"
7,21,free,"The slender architecture student gave a candid interview about her elementary school experiences, where she first conceived her passion for building design. Her seemingly abundant creativity helped her perish any doubts about her career choice.",その細身の建築学生は、建築デザインへの情熱を最初に抱いた小学校での経験について率直なインタビューを行いました。彼女の一見豊富な創造性は、キャリアの選択に関する疑念を払拭するのに役立ちました。,,"{""1304"": ""slender"", ""1306"": ""candid"", ""1308"": ""conceive"", ""1310"": ""elementary"", ""1313"": ""seemingly"", ""1314"": ""architecture"", ""1318"": ""perish"", ""1322"": ""abundant""}"
7,22,academic,"The phenomenon of climate change has led to approximately 1.5°C of global warming, creating a fierce impact on weather patterns worldwide. To ensure the survival of vulnerable ecosystems, scientists have developed a mixture of adaptation strategies. However, these solutions remain imperfect, as evidenced by the increasing frequency of extreme weather events. With only a narrow margin for error, researchers have had to suspend certain field studies due to risky conditions, particularly in regions experiencing unprecedented rainfall and damp conditions.",気候変動という現象により、世界の気温は約1.5度上昇し、世界中の気象パターンに激しい影響を与えています。脆弱な生態系の生存を確保するため、科学者たちは様々な適応戦略を組み合わせて開発してきました。しかし、これらの解決策は不完全なままで、それは増加する極端な気象現象からも明らかです。わずかな誤差の余地しかない中、研究者たちは、特に前例のない降雨量と湿潤な状況が発生している地域では、危険な状況により特定のフィールド調査を中断せざるを得ませんでした。,環境科学に関する学術的な文章,"{""1323"": ""approximately"", ""1324"": ""ensure"", ""1325"": ""fierce"", ""1327"": ""imperfect"", ""1328"": ""mixture"", ""1329"": ""phenomenon"", ""1330"": ""damp"", ""1331"": ""margin"", ""1334"": ""risky"", ""1336"": ""suspend""}"
7,23,conversation,Did you hear that howl last night? It was like something from a nightmare! I couldn't sleep during the whole recess period.,昨夜のあの遠吠えを聞いた？まるで悪夢みたいだったよ！休み時間中ずっと眠れなかったよ。,学生同士の会話。休み時間中の出来事について話している。,"{""1326"": ""howl"", ""1332"": ""nightmare"", ""1333"": ""recess""}"
7,24,free,"The supreme court's decision came as a surprise to many legal experts. The ruling demonstrated that even the highest judicial authority can make decisions that some consider imperfect, leaving only a small margin for interpretation.",最高裁判所の判決は多くの法律の専門家たちにとって驚きでした。この判決は、最高司法機関でさえも一部から不完全とみなされる判断を下すことがあり、解釈の余地がわずかしか残されていないことを示しました。,法律に関する一般的な文章,"{""1327"": ""imperfect"", ""1331"": ""margin"", ""1335"": ""supreme""}"
