group_id,sentence_id,sentence_type,sentence_content_en,translated_sentence,note,words_contained_dict
25,1,academic,"Recent advances in anthropology and archaeology have revolutionized our understanding of human evolution. Through careful excavation and radiocarbon dating of artifacts, researchers have traced the development from Australopithecus to Homo erectus, and eventually to Homo sapiens. The transition to bipedal locomotion marked a crucial evolutionary milestone, while the discovery of various Stone Age tools, including chipped stone tools and primitive axes, has illuminated the technological progression of our ancestors. The emergence of Cro-Magnon and their eventual replacement of Neanderthals represents one of the most fascinating chapters in human prehistory.",人類学と考古学における最近の進歩により、人類の進化に関する理解が革新的に進みました。慎重な発掘調査と遺物の放射性炭素年代測定を通じて、研究者たちはアウストラロピテクスからホモ・エレクトス、そして最終的にホモ・サピエンスへの発展を追跡してきました。二足歩行への移行は進化における重要な節目となり、打製石器や原始的な斧を含む様々な石器時代の道具の発見により、私たちの祖先の技術的進歩が明らかになりました。クロマニョン人の出現とネアンデルタール人の最終的な置き換えは、人類の先史時代における最も魅力的な章の一つを表しています。,人類進化に関する学術的な概要,"{""3824"": ""anthropology"", ""3825"": ""archaeology"", ""3826"": ""Australopithecus"", ""3827"": ""bipedal"", ""3828"": ""Cro-Magnon"", ""3829"": ""Homo erectus"", ""3830"": ""Homo sapiens"", ""3831"": ""Neanderthal"", ""3843"": ""Stone Age"", ""3846"": ""excavation"", ""3848"": ""radiocarbon dating"", ""3850"": ""artifact"", ""3851"": ""ax"", ""3853"": ""chipped stone tools""}"
25,2,conversation,"Hey, did you see that new exhibition at the temple? They've got some amazing relics from the Bronze Age and Iron Age on display. The bow-and-arrow collection is absolutely sick!",ねぇ、お寺での新しい展示見た？青銅器時代と鉄器時代の素晴らしい遺物が展示されてるんだよ。弓矢のコレクションがマジやばいよ！,博物館展示について話す若者同士の会話,"{""3833"": ""Bronze Age"", ""3835"": ""Iron Age"", ""3844"": ""temple"", ""3849"": ""relic"", ""3852"": ""bow-and-arrow""}"
25,3,academic,"The migration patterns of early humans from the Old World to the New World have been extensively studied. Archaeological evidence suggests that during the Ice Age, people crossed the Bering Strait using a land bridge that connected Asia to North America. This journey, which likely occurred during the Paleolithic Age, represents one of the most significant human migrations in history. Recent discoveries in burial mounds across both continents have provided valuable insights into these ancient movements.",旧世界から新世界への初期人類の移動パターンは広く研究されてきました。考古学的証拠は、氷河期の間、人々がアジアと北アメリカを結ぶ陸橋を使用してベーリング海峡を渡ったことを示唆しています。旧石器時代に起こったと考えられるこの移動は、人類史上最も重要な移動の一つを表しています。両大陸の埋葬塚での最近の発見は、これらの古代の移動について貴重な洞察を提供しています。,人類の大規模移動に関する学術的な説明,"{""3832"": ""Bering Strait"", ""3834"": ""Ice Age"", ""3836"": ""land bridge"", ""3838"": ""migration"", ""3840"": ""New World"", ""3841"": ""Old World"", ""3842"": ""Paleolithic Age"", ""3845"": ""burial"", ""3847"": ""mound""}"
25,4,free,"The transition from the Mesolithic Age through the Neolithic Age to the Stone Age marked significant changes in human development. Each period brought new innovations and cultural practices, particularly evident in the sophisticated tools and artifacts discovered at various archaeological sites.",中石器時代から新石器時代、そして石器時代への移行は、人類の発展における重要な変化を示しました。各時期は新しい革新と文化的実践をもたらし、それは特に様々な考古学的遺跡で発見された精巧な道具や人工遺物に顕著に表れています。,先史時代の文化発展について,"{""3837"": ""Mesolithic Age"", ""3839"": ""Neolithic Age"", ""3843"": ""Stone Age""}"
25,5,academic,"Archaeological evidence suggests that the transition from hunter-gatherer societies to agricultural communities was marked by significant technological and cultural developments. Early settlements featured earthenware and stoneware vessels for storage, while petroglyphic art and pictographs on cliff-dwellings provide insights into ancient cultural practices. The domestication of animals led to advanced husbandry techniques, while cultivation and irrigation systems transformed nomadic populations into settled communities. The development of tools like scrapers for processing pelts and spears for hunting demonstrates the sophistication of early human adaptation.",考古学的証拠によると、狩猟採集社会から農耕社会への移行期には、重要な技術的・文化的発展が見られました。初期の集落では、貯蔵用の土器や陶器が使用され、崖住居の岩面彫刻や絵文字は古代の文化的慣習についての洞察を提供しています。動物の家畜化は高度な畜産技術につながり、農耕と灌漑システムは遊牧民を定住社会へと変えました。毛皮処理用のスクレーパーや狩猟用の槍といった道具の発展は、初期人類の適応の洗練さを示しています。,考古学的な視点から人類の発展を論じる学術的な文章,"{""3854"": ""earthenware"", ""3855"": ""petroglyphic"", ""3856"": ""pictograph"", ""3857"": ""scraper"", ""3858"": ""stoneware"", ""3859"": ""cultivation"", ""3860"": ""domestication"", ""3862"": ""hunter-gatherer"", ""3863"": ""hunting"", ""3864"": ""husbandry"", ""3865"": ""irrigation"", ""3866"": ""nomad"", ""3867"": ""pelt"", ""3869"": ""spear"", ""3871"": ""cliff-dwelling""}"
25,6,conversation,"Hey, did you see that documentary about Native American tribes? The medicine man ceremonies in the Cherokee and Apache communities were fascinating. They still maintain their traditional practices on the reservation.",ねぇ、ネイティブアメリカンの部族についてのドキュメンタリー見た？チェロキーとアパッチのコミュニティでの薬師の儀式が魅力的だったわ。彼らは今でも保留地で伝統的な習慣を守っているのよ。,友人同士の会話。ドキュメンタリー番組についての感想を共有している場面。,"{""3873"": ""medicine man"", ""3874"": ""reservation"", ""3878"": ""Apache"", ""3880"": ""Cherokee""}"
25,7,free,"The Iroquois and Navaho tribes were known for their unique kinship systems and living structures. While the Iroquois preferred longhouses, others lived in teepees or wigwams. Their capricious weather patterns often forced them to forage and practice slash-and-burn agriculture, moving their camps seasonally.",イロコイ族とナバホ族は、独特の親族制度と居住構造で知られていました。イロコイ族はロングハウスを好んだ一方で、他の部族はティピーやウィグワムに住んでいました。気まぐれな天候パターンにより、彼らはしばしば食料を採集し、焼畑農業を行い、季節ごとにキャンプを移動することを余儀なくされました。,ネイティブアメリカンの生活様式についての説明文,"{""3861"": ""forage"", ""3868"": ""slash-and-burn"", ""3870"": ""camp"", ""3872"": ""longhouse"", ""3875"": ""teepee"", ""3876"": ""wigwam"", ""3879"": ""capricious"", ""3881"": ""iroquois"", ""3882"": ""kinship"", ""3883"": ""Navaho""}"
25,8,academic,"The strategic use of ambush tactics in hunting was a crucial survival skill for many indigenous peoples, combining both traditional knowledge and environmental awareness.",狩猟における待ち伏せ戦術の戦略的使用は、多くの先住民にとって重要な生存技術であり、伝統的な知識と環境認識の両方を組み合わせたものでした。,狩猟戦術についての学術的な説明,"{""3863"": ""hunting"", ""3877"": ""ambush""}"
25,9,academic,"The American Revolution and subsequent establishment of the Republic marked a pivotal transformation in world history. The Continental Congress, which adopted the Declaration of Independence, laid the groundwork for the U.S. Constitution. This revolutionary period saw the emergence of a new nation built on democratic principles, though the institution of slavery remained a contentious issue. The Civil War later erupted, leading to the abolition of slavery and the Emancipation of millions. The subsequent Reconstruction era brought significant changes to American society, particularly in the South where former plantations were divided and redistributed.",アメリカ革命とそれに続く共和国の設立は、世界史における重要な転換点となりました。独立宣言を採択した大陸会議は、米国憲法の基礎を築きました。この革命期には民主主義の原則に基づく新しい国家が誕生しましたが、奴隷制度は依然として論争の的でした。その後の南北戦争は奴隷制度の廃止と何百万人もの解放をもたらしました。続く再建期には、特に南部において旧プランテーションが分割され再分配されるなど、アメリカ社会に大きな変化がもたらされました。,アメリカの歴史的な転換点を学術的に説明する文章,"{""3894"": ""abolition"", ""3895"": ""Continental Congress"", ""3896"": ""Declaration of Independence"", ""3897"": ""plantation"", ""3898"": ""Republic"", ""3899"": ""slavery"", ""3900"": ""The American Revolution"", ""3901"": ""The Civil War"", ""3903"": ""U.S. Constitution"", ""3904"": ""Emancipation"", ""3909"": ""Reconstruction""}"
25,10,conversation,"Hey, did you know my ancestors were actually Pilgrims who came over on the Mayflower to Plymouth Colony? They later moved to a homestead in what used to be Sioux territory.",ねえ、私の先祖が実はメイフラワー号でプリマス植民地にやって来たピルグリムだったって知ってた？その後、かつてスー族の領地だった場所にホームステッドを構えたんだよ。,友人との歴史的な家族の背景についての会話,"{""3885"": ""Sioux"", ""3890"": ""Pilgrims"", ""3891"": ""Plymouth Colony"", ""3905"": ""homestead""}"
25,11,free,"The Pueblo people established sophisticated settlements long before European explorers arrived in North America. Historians have documented how these indigenous communities managed their land grants effectively, creating sustainable agricultural systems that modern scholars still study today.",プエブロの人々は、ヨーロッパの探検家が北米に到着するはるか以前に、洗練された居留地を確立していました。歴史家たちは、これらの先住民コミュニティが土地の譲渡を効果的に管理し、現代の学者たちが今でも研究している持続可能な農業システムを作り上げた様子を記録しています。,,"{""3884"": ""Pueblo"", ""3887"": ""explorer"", ""3888"": ""historian"", ""3893"": ""settlement"", ""3906"": ""land grant""}"
25,12,academic,"The concept of Manifest Destiny drove many Americans to emigrate westward, often traveling by stagecoach or steamboat to claim their plot of land. This expansion, however, led to conflicts with Native American tribes and raised questions about The Confederation's ability to manage territorial expansion. The Civil Rights movement of the 20th century would later address many of the social inequities that emerged during this period of rapid westward expansion.",天命思想は多くのアメリカ人を西部への移住へと駆り立て、彼らはしばしば駅馬車や蒸気船を使って土地区画の権利を主張しに行きました。しかし、この拡大は先住民部族との衝突を引き起こし、連合の領土拡大管理能力に疑問を投げかけることとなりました。20世紀の公民権運動は、この急速な西部拡大期に生じた多くの社会的不平等に後に取り組むことになります。,,"{""3886"": ""emigrate"", ""3907"": ""Manifest Destiny"", ""3908"": ""plot of land"", ""3910"": ""stagecoach"", ""3911"": ""steamboat"", ""3912"": ""The Confederation"", ""3913"": ""Civil Rights movement""}"
25,13,academic,"The Jamestown Colony, established before the arrival of the Puritans, represented one of the earliest English settlements in North America. While the Puritans sought religious freedom in their northern colonies, Jamestown's focus was primarily commercial, setting a precedent for different models of colonial development.",ピューリタンの到着以前に設立されたジェームズタウン植民地は、北米における最も初期の英国の入植地の一つでした。ピューリタンが北部の植民地で宗教の自由を求める一方、ジェームズタウンは主に商業的な目的を持っており、これは植民地開発の異なるモデルの先例となりました。,,"{""3889"": ""Jamestown Colony"", ""3892"": ""Puritans"", ""3893"": ""settlement""}"
25,14,academic,"The period following The Great Depression marked significant changes in American governance, with The New Deal introducing unprecedented federal government intervention. This era of industrialization and social reform also saw the culmination of the women's suffrage movement. The executive branch, led by President Roosevelt, worked closely with Congress and the House of Representatives to implement sweeping reforms. The Justice Department and Attorney General played crucial roles in enforcing these new policies, while the legislative branch enacted numerous groundbreaking laws. This transformation of American society continued through The Cold War, during which the integration of ethnic diversity became increasingly important, despite ongoing challenges with segregation.",大恐慌後の時期はアメリカの統治に大きな変化をもたらし、ニューディール政策は前例のない連邦政府の介入をもたらしました。この産業化と社会改革の時代は、女性参政権運動の集大成も見ました。行政府は、ルーズベルト大統領の指導のもと、議会および下院と緊密に協力して広範な改革を実施しました。司法省と司法長官はこれらの新政策の執行において重要な役割を果たし、立法府は数多くの画期的な法律を制定しました。このアメリカ社会の変革は冷戦期を通じて続き、人種隔離の課題が続く中でも、民族的多様性の統合がますます重要になっていきました。,20世紀アメリカの政治・社会変革について述べた学術的な文章,"{""3914"": ""ethnic diversity"", ""3915"": ""industrialization"", ""3916"": ""integration"", ""3919"": ""segregation"", ""3920"": ""The Cold War"", ""3921"": ""The Great Depression"", ""3922"": ""The New Deal"", ""3923"": ""women's suffrage"", ""3927"": ""federal government"", ""3933"": ""attorney"", ""3934"": ""Attorney General"", ""3935"": ""Congress"", ""3936"": ""executive branch"", ""3937"": ""House of Representatives"", ""3940"": ""Justice Department"", ""3941"": ""legislative branch""}"
25,15,conversation,"Hey, did you see that documentary about the melting pot of cultures in New York? It's crazy how the local government handles all that diversity!",ねぇ、ニューヨークの文化のるつぼについてのドキュメンタリー見た？地方政府があの多様性全部をどう扱ってるか、すごいよね！,友人同士の casual な会話。ドキュメンタリー番組について話している場面。,"{""3917"": ""melting pot"", ""3929"": ""local government""}"
25,16,free,"Throughout history, the transition from Empire to confederation has often been marked by periods of oligarchy or dictatorship. The imperial ambitions of state governments frequently clash with the judicial branch's interpretation of constitutional rights, requiring careful administration by the Secretary of State to maintain balance.",歴史を通じて、帝国から連邦制への移行は、しばしば寡頭制や独裁制の期間を伴ってきました。州政府の帝国主義的な野心は、しばしば司法部門による憲法上の権利の解釈と衝突し、バランスを保つために国務長官による慎重な行政運営が必要とされます。,政治体制の変遷について述べた文章,"{""3924"": ""confederation"", ""3925"": ""dictatorship"", ""3926"": ""Empire"", ""3928"": ""imperial"", ""3930"": ""oligarchy"", ""3931"": ""state government"", ""3932"": ""administration"", ""3938"": ""judicial"", ""3939"": ""judicial branch"", ""3943"": ""Secretary of State""}"
25,17,conversation,My attorney says we need to file these papers with the legislature ASAP. Can you believe how much bureaucracy we have to deal with?,私の弁護士が、これらの書類を立法府にすぐに提出する必要があるって言ってるの。こんなに官僚主義的な手続きが必要だなんて信じられる？,ビジネス関連の会話。行政手続きについての愚痴,"{""3933"": ""attorney"", ""3942"": ""legislature""}"
25,18,academic,"The judicial system in modern democracies operates independently from other branches of government, ensuring checks and balances. This separation of powers, established through careful integration of various governmental functions, prevents any single entity from becoming too powerful. The race to maintain this balance while addressing contemporary challenges requires constant vigilance from all levels of administration.",現代民主主義における司法制度は、他の政府部門から独立して運営され、抑制と均衡を確保しています。様々な政府機能の慎重な統合を通じて確立されたこの権力分立は、単一の組織が強大化することを防いでいます。現代の課題に対処しながらこのバランスを維持する競争には、すべての行政レベルからの絶え間ない警戒が必要です。,司法制度と権力分立について述べた学術的な文章,"{""3916"": ""integration"", ""3918"": ""race"", ""3932"": ""administration"", ""3938"": ""judicial""}"
25,19,academic,"The American system of governance operates through a complex interplay of federal institutions. The Senate, working alongside the State Department and Supreme Court, forms the backbone of federal authority. Various cabinet-level departments, including Agriculture, Commerce, Defense, and Education, collaborate to implement national policies. The Department of Health and Human Services coordinates with Housing and Urban Development to address social welfare issues, while The Treasury manages economic policies. The partisan divide between the Democratic Party and Republican Party often influences policy decisions, with conservative members frequently opposing progressive initiatives across these institutions.",アメリカの統治システムは、連邦機関の複雑な相互作用を通じて機能しています。上院は国務省と最高裁判所と共に、連邦権力の中核を形成しています。農務省、商務省、国防総省、教育省を含む様々な閣僚級部門が、国家政策を実施するために協力しています。保健福祉省は住宅都市開発省と協力して社会福祉の問題に取り組み、財務省は経済政策を管理しています。民主党と共和党の間の党派的な分断は、しばしば政策決定に影響を与え、保守的なメンバーは、これらの機関全体で進歩的なイニシアチブに頻繁に反対しています。,,"{""3944"": ""Senate"", ""3945"": ""State Department"", ""3946"": ""Supreme Court"", ""3947"": ""Agriculture"", ""3949"": ""Commerce"", ""3950"": ""Defense"", ""3951"": ""Education"", ""3953"": ""Health and Human Services"", ""3954"": ""Housing and Urban Development"", ""3956"": ""The Treasury"", ""3958"": ""conservative"", ""3959"": ""Democratic Party"", ""3961"": ""partisan"", ""3963"": ""Republican Party"", ""3964"": ""State""}"
25,20,conversation,"Hey, did you hear that our city council just appointed a new Commissioner? The mayor seems pretty excited about working with them on transportation issues.",ねえ、市議会が新しい委員を任命したって聞いた？市長は交通問題について新委員と働くことにすごく期待してるみたいだよ。,友人同士の casual な会話。地域の政治についての話題。,"{""3957"": ""transportation"", ""3966"": ""city"", ""3967"": ""city council"", ""3968"": ""Commissioner"", ""3973"": ""mayor""}"
25,21,free,"The Department of Energy and The Interior work closely with state and local governments to balance environmental protection with development needs. The county board and lieutenant governor recently met to discuss new initiatives for sustainable resource management, while the county Labor office focuses on creating new job opportunities.",エネルギー省と内務省は、環境保護と開発ニーズのバランスを取るため、州政府や地方政府と緊密に協力しています。郡委員会と副知事は最近、持続可能な資源管理のための新しいイニシアチブについて協議を行い、一方で郡の労働局は新しい雇用機会の創出に焦点を当てています。,,"{""3952"": ""Energy"", ""3960"": ""Labor"", ""3964"": ""State"", ""3965"": ""The Interior"", ""3969"": ""county"", ""3970"": ""county board"", ""3971"": ""governor"", ""3972"": ""lieutenant governor""}"
25,22,academic,"The role of the president in American governance extends beyond mere executive functions, encompassing leadership of both domestic and international affairs. Working closely with ambassadors and the Department of Justice, the president must navigate complex diplomatic relationships while ensuring the fair administration of law. The governor of each state maintains similar responsibilities at the state level, though their authority is necessarily more limited in scope.",アメリカの統治における大統領の役割は、単なる行政機能を超えて、国内外の問題における指導力を包含しています。大使や司法省と緊密に協力しながら、大統領は法の公平な施行を確保しつつ、複雑な外交関係を舵取りしなければなりません。各州の知事も州レベルで同様の責任を負っていますが、その権限は必然的により限定的な範囲に留まります。,,"{""3948"": ""ambassador"", ""3955"": ""Justice"", ""3962"": ""president"", ""3964"": ""State"", ""3971"": ""governor""}"
25,23,academic,"The dynamics of municipal elections have evolved significantly in recent decades. In modern precincts, the incumbent's advantage has diminished as digital polling methods have made voter sentiment more transparent. The role of the vice president as a running mate has become increasingly crucial, particularly in cases where term of office limitations affect the presidential nominee. Studies show that traditional voting patterns in townships and villages are shifting, with ward-level data indicating a more sophisticated electorate that carefully evaluates candidates who run for office.",地方選挙のダイナミクスは近年大きく進化しています。現代の投票区では、デジタル世論調査手法により有権者の意向がより透明になり、現職者のアドバンテージは減少しています。副大統領の役割は、特に在任期間の制限が大統領候補に影響を与える場合、副候補として一層重要になってきています。研究によると、タウンシップや村落での伝統的な投票パターンは変化しており、区レベルのデータは、立候補者を慎重に評価するより洗練された有権者の存在を示しています。,選挙制度と投票行動の変化に関する学術的な分析,"{""3974"": ""municipal"", ""3975"": ""vice president"", ""3976"": ""election"", ""3977"": ""incumbent"", ""3978"": ""nominee"", ""3979"": ""poll"", ""3980"": ""precinct"", ""3981"": ""run for office"", ""3982"": ""running mate"", ""3983"": ""term of office"", ""3984"": ""township"", ""3985"": ""village"", ""3986"": ""ward""}"
25,24,conversation,Did you hear about Sarah? She's planning to run for office in our municipal election next year. She'd make a great vice president of the student council!,サラのこと聞いた？来年の市議会選挙に立候補するつもりなんだって。彼女なら学生会の副会長として素晴らしい働きをすると思うわ！,大学のキャンパスでの会話。学生同士が友人の政治的な野心について話している場面。,"{""3974"": ""municipal"", ""3975"": ""vice president"", ""3976"": ""election"", ""3981"": ""run for office""}"
