group_id,sentence_id,sentence_type,sentence_content_en,translated_sentence,note,words_contained_dict
6,1,academic,"The overall impact of environmental pollution on rural landscapes has become a severe concern for scientists. Constant industrial emissions and harmful chemical compounds tend to drift across agricultural regions, causing external damage to ecosystems. Research indicates a definite correlation between the abuse of natural resources and the passive acceptance of environmental degradation. The landscape's natural recovery mode appears to be compromised, as toxic spills and atmospheric pollution continue to pose significant threats. This mutual relationship between human activities and environmental deterioration requires immediate attention to prevent irreversible damage.",環境汚染が農村部の景観に与える全体的な影響は、科学者たちにとって深刻な懸念事項となっています。絶え間ない産業排出物と有害な化合物が農業地域を漂流し、生態系に外部的な被害をもたらす傾向があります。自然資源の乱用と環境悪化に対する受動的な容認との間には、明確な相関関係があることが研究により示されています。有害物質の流出と大気汚染が重大な脅威を続けているため、景観の自然な回復モードは損なわれているように見えます。人間活動と環境悪化のこの相互関係は、取り返しのつかない被害を防ぐために即座の注意を必要としています。,,"{""1018"": ""abuse"", ""1019"": ""constant"", ""1020"": ""drift"", ""1021"": ""overall"", ""1022"": ""passive"", ""1023"": ""rural"", ""1026"": ""external"", ""1027"": ""harmful"", ""1029"": ""landscape"", ""1030"": ""pollution"", ""1032"": ""spill"", ""1033"": ""compound"", ""1034"": ""definite"", ""1035"": ""mode"", ""1036"": ""mutual"", ""1037"": ""recovery"", ""1047"": ""severe""}"
6,2,conversation,"Hey, did you see how that coward just surrendered and departed when things got tough? Such a miserable display of character!",ねぇ、物事が大変になった時にあの臆病者がどうやって降参して立ち去ったか見た？ なんて情けない性格の表れだよ！,友人間での他者の行動に対する批判的な会話,"{""1038"": ""surrender"", ""1041"": ""coward"", ""1043"": ""depart"", ""1046"": ""miserable""}"
6,3,free,"As the gentle breeze swept through the valley, my instinct told me something was wrong. The idle chatter of birds had vanished, and the infant deer that usually resembled their mothers in behavior were nowhere to be seen. Nature's tendency to warn of danger was clear.",穏やかな風が谷を吹き抜けた時、私の本能は何かがおかしいと告げていました。鳥たちのむだなさえずりは消え失せ、普段は母親の行動に似ている子鹿たちの姿も見当たりませんでした。危険を警告する自然の傾向は明らかでした。,,"{""1024"": ""tendency"", ""1025"": ""breeze"", ""1028"": ""instinct"", ""1031"": ""resemble"", ""1040"": ""vanish"", ""1044"": ""idle"", ""1045"": ""infant""}"
6,4,conversation,Don't try to deceive me about your task progress. I need a definite answer!,タスクの進捗について私を欺こうとしないで。はっきりとした答えが必要なの！,上司と部下の間での緊張した会話,"{""1034"": ""definite"", ""1039"": ""task"", ""1042"": ""deceive"", ""1047"": ""severe""}"
6,5,academic,"The agricultural sector has faced immense challenges in recent years, particularly in livestock management and orchard maintenance. The steep decline in productivity, combined with internal market pressures, has led many farmers to resort to innovative solutions. The primary concern remains the output optimization, while maintaining desirable quality standards. In this context, vertical farming has emerged as a representative solution, launching a new era in agricultural technology. The latter approach has shown splendid results, especially in regions where traditional farming faces calamity due to climate change.",農業セクターは近年、特に家畜管理と果樹園の維持において、膨大な課題に直面しています。生産性の急激な低下と、内部市場からの圧力が重なり、多くの農家が革新的な解決策に頼るようになっています。望ましい品質基準を維持しながら、生産量の最適化が主要な懸念事項となっています。この文脈において、垂直農法が代表的な解決策として台頭し、農業技術の新時代を開始しています。後者のアプローチは、特に従来型の農業が気候変動による災害に直面している地域で、素晴らしい結果を示しています。,,"{""1048"": ""steep"", ""1051"": ""context"", ""1052"": ""steep"", ""1053"": ""immense"", ""1055"": ""splendid"", ""1056"": ""calamity"", ""1057"": ""livestock"", ""1058"": ""orchard"", ""1059"": ""resort"", ""1060"": ""sector"", ""1061"": ""vertical"", ""1064"": ""desirable"", ""1066"": ""launch"", ""1068"": ""output"", ""1072"": ""internal"", ""1074"": ""latter"", ""1076"": ""primary"", ""1077"": ""representative""}"
6,6,conversation,"Hey, did you see how Tom tried to imitate that TikTok dance? It was so chaotic, but it really amused everyone at the party!",ねぇ、トムがTikTokのダンスをマネしようとしてたの見た？めちゃくちゃだったけど、パーティーの皆を本当に楽しませてたよ！,若者同士のカジュアルな会話。ソーシャルメディアの話題。,"{""1049"": ""amuse"", ""1052"": ""imitate"", ""1070"": ""chaotic""}"
6,7,free,"The beam of sunlight pierced through the cherry blossoms, creating a medium through which nature's beauty could be observed. The illegal dumping in the gulf had interrupted this natural harmony, and environmental activists urged immediate action to obtain justice for this harmful deed.",太陽の光線が桜の花を通り抜け、自然の美しさを観察できる媒体となっていました。湾での不法投棄がこの自然の調和を妨げ、環境活動家たちはこの有害な行為に対する正義を得るため、即座の行動を促しました。,,"{""1050"": ""blossom"", ""1062"": ""deed"", ""1063"": ""beam"", ""1065"": ""gulf"", ""1067"": ""obtain"", ""1069"": ""urge"", ""1071"": ""illegal"", ""1073"": ""interrupt"", ""1075"": ""medium""}"
6,8,academic,"In the context of modern warfare, revenge-driven conflicts have led to increasingly chaotic situations across multiple sectors. The output of military technology has seen an immense increase, with a primary focus on vertical launch systems. This has created a desirable advantage for nations seeking to obtain strategic superiority, though the internal consequences of such developments remain concerning.",現代の戦争という文脈において、復讐に動機づけられた紛争が複数のセクターで、ますます混沌とした状況を引き起こしています。軍事技術の生産は膨大な増加を見せており、特に垂直発射システムに主眼が置かれています。これは戦略的優位性を得ようとする国々にとって望ましい利点を生み出していますが、そのような開発の内部的な影響は依然として懸念されています。,,"{""1051"": ""context"", ""1053"": ""immense"", ""1054"": ""revenge"", ""1060"": ""sector"", ""1061"": ""vertical"", ""1064"": ""desirable"", ""1066"": ""launch"", ""1067"": ""obtain"", ""1068"": ""output"", ""1070"": ""chaotic"", ""1072"": ""internal"", ""1076"": ""primary""}"
6,9,academic,"Recent surveys reveal that modern physicians increasingly disagree with primitive medical practices, despite their historical virtue. The fundamental issue lies in the extent to which traditional healing methods can assure patient safety. A comprehensive publication by the International Medical Convention highlights that while some conventional treatments may have merit, the breadth of modern medical enterprise has transformed healthcare. The triumph of evidence-based medicine over traditional practices has led to the promotion of standardized treatment protocols, though this transition has not been without penalty for practitioners who forfeit their traditional methods.",最近の調査によると、現代の医師たちは、伝統的な医療行為の歴史的価値にもかかわらず、原始的な医療行為にますます反対していることが明らかになっています。根本的な問題は、伝統的な治療法がどの程度まで患者の安全を保証できるかという点にあります。国際医療会議による包括的な出版物は、従来の治療法にも利点がある可能性がある一方で、現代の医療事業の広がりがヘルスケアを変革したことを強調しています。伝統的な治療法に対するエビデンスに基づく医療の勝利により、標準化された治療プロトコルが推進されていますが、この移行は伝統的な方法を放棄する医療従事者にとってペナルティを伴うものでした。,,"{""1078"": ""virtue"", ""1079"": ""approval"", ""1080"": ""assure"", ""1083"": ""physician"", ""1084"": ""promote"", ""1085"": ""reveal"", ""1089"": ""penalty"", ""1090"": ""primitive"", ""1092"": ""survey"", ""1096"": ""disagree"", ""1097"": ""extent"", ""1098"": ""forfeit"", ""1100"": ""triumph"", ""1101"": ""breadth"", ""1103"": ""convention"", ""1104"": ""enterprise"", ""1105"": ""fundamental"", ""1107"": ""publication""}"
6,10,conversation,"Hey, did you see Sarah dash across the construction site without approval? She might injure herself near that boundary!",ねぇ、サラが許可なく建設現場を走り抜けていくのを見た？境界線の近くで怪我をするかもしれないよ！,建設現場で友人の危険な行動を目撃した際の会話,"{""1079"": ""approval"", ""1081"": ""dash"", ""1094"": ""boundary"", ""1095"": ""construction"", ""1099"": ""injure""}"
6,11,free,"The estate's harvest season brought unexpected challenges as workers had to fold thousands of boxes for the produce. At the summit of the mountain, they could survey the vast fields below, while drafting plans for next year's crop rotation.",その農園の収穫期は、作物用の何千もの箱を折りたたまなければならない労働者たちにとって予期せぬ課題をもたらしました。山頂では、下方の広大な畑を見渡しながら、来年の輪作の計画を立てることができました。,,"{""1082"": ""fold"", ""1086"": ""draft"", ""1087"": ""estate"", ""1088"": ""harvest"", ""1091"": ""summit"", ""1092"": ""survey""}"
6,12,conversation,"I can't believe they would insult our enterprise like that! Under these circumstances, we should tear up the contract.",彼らが私たちの事業をそんな風に侮辱するなんて信じられない！このような状況では、契約書を破棄すべきだわ。,ビジネス上の侮辱的な対応に対する怒りの表現,"{""1093"": ""tear"", ""1102"": ""circumstance"", ""1104"": ""enterprise"", ""1106"": ""insult""}"
6,13,academic,"The efficient transportation systems of modern cities have undergone significant transformations, with impressive extensions to their width and interior infrastructure. Liberal policies have previously focused on preventing traffic disasters through the implementation of remarkable safety measures. The atmosphere of urban mobility has shifted towards more sustainable solutions, requiring civil engineering innovations. These developments have not only fastened the pace of urban growth but have also created privileged zones of accessibility.",現代都市の効率的な交通システムは大きな変革を遂げ、その幅員と内部インフラの印象的な拡張が行われてきました。リベラルな政策は、これまで顕著な安全対策の実施を通じて交通災害の防止に重点を置いてきました。都市モビリティの雰囲気は、より持続可能なソリューションへと移行し、土木工学の革新を必要としています。これらの発展は都市の成長のペースを加速させただけでなく、アクセシビリティの特権的なゾーンを生み出しました。,,"{""1108"": ""Transportation"", ""1109"": ""width"", ""1113"": ""liberal"", ""1116"": ""privilege"", ""1119"": ""civil"", ""1120"": ""efficient"", ""1122"": ""impressive"", ""1123"": ""remarkable"", ""1124"": ""significant"", ""1130"": ""interior"", ""1133"": ""prevent"", ""1134"": ""previously"", ""1135"": ""atmosphere"", ""1136"": ""disaster"", ""1137"": ""fasten""}"
6,14,conversation,"Hey, I need to apologize for the panic I caused at your athletic competition yesterday. I didn't mean to scare anyone!",あのさ、昨日の運動競技会で騒ぎを起こしちゃって謝らないと。誰かを怖がらせるつもりはなかったんだ！,友人間での謝罪の会話,"{""1110"": ""athletic"", ""1117"": ""scare"", ""1118"": ""apologize"", ""1132"": ""panic""}"
6,15,free,"The poisonous snake's fame spread quickly through the village, causing the obedient locals to submit to new safety guidelines. The grief of losing livestock to the creature led them to bequeath their traditional farming methods to more modern approaches.",毒蛇の噂は村中にすぐに広まり、従順な地域住民は新しい安全ガイドラインに従うことになりました。家畜を失った悲しみから、彼らは伝統的な農業方法を現代的なアプローチに移行することを決めました。,,"{""1112"": ""fame"", ""1114"": ""obedient"", ""1115"": ""poisonous"", ""1125"": ""submit"", ""1126"": ""bequeath"", ""1129"": ""grief"", ""1131"": ""obey""}"
6,16,conversation,I need to deposit this check at the bank before heading to my final destination. The guilt of being late is killing me!,最終目的地に向かう前に、この小切手を銀行に預けないと。遅刻することへの罪悪感で死にそう！,急いでいる状況での独り言のような会話,"{""1121"": ""guilt"", ""1127"": ""deposit"", ""1128"": ""destination""}"
6,17,academic,"Recent studies investigating the psychological impact of social media have revealed a concerning pattern where initial enthusiasm often transforms into visible hatred among users. The modest beginnings of these platforms, designed to foster cooperation and positive movement in social connections, have been stalled by the impulse-driven nature of online interactions. A shortage of wisdom in digital discourse has led many elderly users to quit these platforms, while researchers restore faith in technology through panels focused on governing online behavior. The uncertainty surrounding social media's future has become increasingly apparent, as we witness both heroic attempts to improve these spaces and the perpetual circuit of negativity.",ソーシャルメディアの心理的影響を調査した最近の研究では、当初の熱意がしばしばユーザー間の目に見える憎しみへと変化する懸念すべきパターンが明らかになっています。社会的つながりにおける協力と前向きな動きを促進するために設計されたこれらのプラットフォームの控えめな始まりは、オンライン上のやり取りの衝動的な性質によって停滞しています。デジタル言論における知恵の不足により、多くの高齢者ユーザーがこれらのプラットフォームを離れる一方で、研究者たちはオンライン行動を管理することに焦点を当てたパネルを通じて、テクノロジーへの信頼を回復しています。,ソーシャルメディアの影響に関する学術的な分析,"{""1138"": ""hatred"", ""1141"": ""restore"", ""1143"": ""impulse"", ""1144"": ""initial"", ""1145"": ""modest"", ""1146"": ""movement"", ""1147"": ""quit"", ""1148"": ""shortage"", ""1149"": ""stall"", ""1150"": ""visible"", ""1153"": ""circuit"", ""1154"": ""cooperation"", ""1155"": ""heroic"", ""1156"": ""panel"", ""1158"": ""wisdom"", ""1162"": ""elderly"", ""1163"": ""govern"", ""1164"": ""investigate"", ""1167"": ""uncertain""}"
6,18,conversation,"Hey, did you get that packet I sent to your postal address? My beloved grandmother's residence is uncertain right now, so I had to send it to you instead.",ねぇ、私が郵送先に送ったパケット受け取った？大好きな祖母の住所が今はっきりしないから、代わりにあなたに送らないといけなかったの。,友人同士のカジュアルな会話,"{""1139"": ""packet"", ""1140"": ""postal"", ""1151"": ""beloved"", ""1157"": ""residence"", ""1167"": ""uncertain""}"
6,19,free,"Deep in the wilderness, where the thrill of adventure meets raw nature, a group of researchers discovered an ancient circuit of stone monuments. Their initial investigation led them to associate these structures with prehistoric movement patterns, requiring extensive cooperation to restore and study them properly.",冒険のスリルと原生自然が交わる奥深い荒野で、研究者たちは古代の石碑の回路を発見しました。彼らの初期の調査により、これらの構造物が先史時代の移動パターンと関連していることが分かり、適切な修復と研究には広範な協力が必要とされました。,,"{""1141"": ""restore"", ""1142"": ""wilderness"", ""1144"": ""initial"", ""1146"": ""movement"", ""1153"": ""circuit"", ""1154"": ""cooperation"", ""1160"": ""associate"", ""1166"": ""thrill""}"
6,20,academic,"The government's recent ban on certain quantities of medical supplies has led to a significant shortage in hospitals. Medical professionals assist the elderly while trying to investigate alternative solutions. Despite the visible challenges, there remains a modest hope that international cooperation will help restore normal supply levels. Some facilities have reported patients who bleed while waiting for essential treatments.",政府による特定量の医療用品の禁止により、病院では深刻な不足が生じています。医療専門家は代替策を模索しながら、高齢者の支援を行っています。目に見える課題にもかかわらず、国際協力が通常の供給レベルを回復させるという控えめな希望は残っています。一部の施設では、必要な治療を待つ間に出血する患者が報告されています。,,"{""1141"": ""restore"", ""1145"": ""modest"", ""1148"": ""shortage"", ""1150"": ""visible"", ""1152"": ""bleed"", ""1154"": ""cooperation"", ""1159"": ""assist"", ""1161"": ""ban"", ""1162"": ""elderly"", ""1164"": ""investigate"", ""1165"": ""quantity""}"
6,21,academic,"Recent advancements in thermal imaging technology have revolutionized how scientists detect and analyze volcanic activity. When magma chambers build pressure, researchers can now predict potential volcanic explosions before they explode by analyzing thermal signatures. This technological breakthrough has proven particularly valuable after researchers saw a 300% increase in prediction accuracy compared to traditional methods. The integration of scent detection sensors alongside thermal imaging has further enhanced the system's capabilities, allowing for the detection of subtle changes in volcanic gas compositions.",熱画像技術の最近の進歩により、科学者が火山活動を検出し分析する方法が革新的に変化しました。マグマだまりが圧力を蓄積する際、研究者は熱シグナルを分析することで、火山が爆発する前に潜在的な噴火を予測できるようになりました。この技術的breakthrough（画期的進歩）は、従来の方法と比較して予測精度が300%向上したことで、特に価値があることが証明されました。熱画像と共に匂い検出センサーを統合することで、火山ガスの組成の微妙な変化を検出できるようになり、システムの性能がさらに向上しました。,,"{""1168"": ""explode"", ""1169"": ""saw"", ""1170"": ""scent"", ""1171"": ""thermal""}"
6,22,conversation,"Hey, did you see that chemistry experiment? The whole thing just exploded! Our tutor was so mad!",ねぇ、あの化学実験見た？全部爆発しちゃったんだよ！先生すっごく怒ってた！,高校や大学の実験室での会話,"{""1168"": ""explode"", ""1172"": ""tutor""}"
6,23,free,"The experienced tutor noticed a peculiar scent coming from the thermal processing unit. Having saw similar incidents before, she quickly evacuated the classroom before anything could explode, demonstrating how crucial quick thinking can be in emergency situations.",経験豊富な講師は、熱処理装置から異様な匂いがしていることに気付きました。以前にも同様の事故を目にしていた彼女は、何かが爆発する前に素早く教室を避難させ、緊急時における迅速な判断の重要性を示しました。,,"{""1168"": ""explode"", ""1169"": ""saw"", ""1170"": ""scent"", ""1171"": ""thermal"", ""1172"": ""tutor""}"
6,24,academic,"The extension of human life expectancy over the past century represents one of medicine's greatest achievements. Through advancements in healthcare, nutrition, and living conditions, we have witnessed an unprecedented increase in longevity. This remarkable extension of the human lifespan has, however, brought new challenges to healthcare systems worldwide, particularly in managing age-related chronic conditions and ensuring quality of life for an aging population. Researchers continue to explore innovative approaches to further extend human healthspan, focusing not merely on adding years to life, but on adding life to years.",過去1世紀における人間の平均寿命の延長は、医学における最大の成果の一つを表しています。医療、栄養、生活環境の進歩により、私たちは前例のない寿命の増加を目の当たりにしてきました。この人間の寿命の顕著な延長は、しかしながら、特に加齢に関連する慢性疾患の管理や高齢化する人口の生活の質の確保において、世界中の医療システムに新たな課題をもたらしています。研究者たちは、単に寿命を延ばすだけでなく、人生の質を高めることに焦点を当てながら、人間の健康寿命をさらに延ばすための革新的なアプローチを探求し続けています。,医学・健康に関する学術的な文章,"{""1111"": ""extension""}"
6,25,conversation,"Hey, did you hear about the deadline extension for our final project? Professor Smith gave us an extra week because of all the technical issues people were having.",ねぇ、期末プロジェクトの締め切り延長について聞いた？みんなが技術的な問題を抱えていたから、スミス教授が1週間延長してくれたんだって。,大学生同士の会話。課題の締め切り延長についての話題。,"{""1111"": ""extension""}"
6,26,free,The browser extension I installed last week has completely transformed how I manage my time online. It blocks distracting websites during work hours and provides detailed analytics about my browsing habits. The extension's developer regularly updates it with new features based on user feedback.,先週インストールしたブラウザ拡張機能で、オンラインでの時間管理の方法が完全に変わりました。仕事中は気が散るようなウェブサイトをブロックし、ブラウジング習慣に関する詳細な分析を提供してくれます。この拡張機能の開発者は、ユーザーのフィードバックに基づいて定期的に新機能を追加しています。,テクノロジーに関する一般的な文章,"{""1111"": ""extension""}"
