group_id,sentence_id,sentence_type,sentence_content_en,translated_sentence,note,words_contained_dict
8,1,academic,"The ultimate challenge facing modern urban development lies in finding a satisfactory balance between elegant architectural design and practical facility management. As cities strengthen their infrastructure, executives must evaluate the prudent allocation of resources, regardless of political pressure. The old-fashioned approach to city planning has been gradually refined to accommodate contemporary needs, while maintaining moderate growth rates. Recent studies indicate that we must abolish outdated practices and substitute them with up-to-date sustainable solutions, particularly in areas prone to environmental disturbances.",現代の都市開発が直面する最終的な課題は、優雅な建築デザインと実用的な施設管理との間の満足のいくバランスを見出すことにあります。都市がインフラを強化する中で、経営幹部は政治的圧力に関係なく、慎重な資源配分を評価しなければなりません。都市計画への古風なアプローチは、適度な成長率を維持しながら、現代のニーズに対応するよう徐々に改良されてきました。最近の研究によると、特に環境の乱れを受けやすい地域では、時代遅れの慣行を廃止し、最新の持続可能なソリューションに置き換える必要があることが示されています。,,"{""1337"": ""disturb"", ""1339"": ""refine"", ""1340"": ""satisfactory"", ""1343"": ""elegant"", ""1344"": ""moderate"", ""1345"": ""old-fashioned"", ""1347"": ""substitute"", ""1348"": ""up-to-date"", ""1351"": ""evaluate"", ""1352"": ""executive"", ""1354"": ""prudent"", ""1356"": ""strengthen"", ""1358"": ""ultimate"", ""1359"": ""facility"", ""1362"": ""regardless"", ""1364"": ""urban"", ""1366"": ""abolish""}"
8,2,conversation,"Hey, be alert! The floor is really slippery near the aisle. Some kid spilled their drink.",ねえ、気をつけて！通路の近くの床がすごく滑りやすくなってるよ。子供が飲み物をこぼしたみたい。,スーパーマーケットやショッピングモールでの会話,"{""1341"": ""slippery"", ""1342"": ""alert"", ""1350"": ""aisle""}"
8,3,free,"The magnificent stars twinkle in the night sky, flattering poets and dreamers alike. Despite the famine that plagued the region, the strength of the community's wit and determination helped them find a remedy for their struggles. Those who incline towards helping others often discover their own path to personal growth.",壮大な星々が夜空できらめき、詩人や夢想家たちの心を魅了します。その地域を苦しめた飢饉にもかかわらず、コミュニティの機知と決意の強さが、彼らの苦闘への解決策を見出す助けとなりました。他者を助けることに傾倒する人々は、しばしば自身の成長への道筋を発見するものです。,,"{""1338"": ""incline"", ""1353"": ""famine"", ""1355"": ""strength"", ""1357"": ""twinkle"", ""1360"": ""flatter"", ""1361"": ""magnificent"", ""1363"": ""remedy"", ""1365"": ""wit""}"
8,4,conversation,I need to withdraw from the project. That stubborn manager just won't listen to any of my suggestions!,プロジェクトから降りる必要があるわ。あの頑固なマネージャーが私の提案を全く聞く耳を持たないの！,職場での不満を同僚に話している場面,"{""1346"": ""stubborn"", ""1349"": ""withdraw""}"
8,5,academic,"The assembly of ancient limestone structures reveals a grim reality about early civilizations. Archaeological findings indicate that these eternal monuments, often adorned with ornaments of religious significance, were built during phases of economic depression. The stern leadership of religious patrons would specifically proclaim their power through these constructions. Modern comprehension of these societies stems from studying not only the vivid architectural details but also the cultural context that forbade certain building practices.",古代の石灰岩建造物の構造は、初期文明についての厳しい現実を明らかにしています。考古学的な発見によると、しばしば宗教的な意味を持つ装飾品で飾られたこれらの永遠のモニュメントは、経済的な不況期に建設されました。宗教的な庇護者たちの厳格な指導者層は、これらの建造物を通じて特に自らの権力を宣言していました。これらの社会に関する現代の理解は、鮮やかな建築の詳細だけでなく、特定の建築慣行を禁じていた文化的背景の研究からも得られています。,,"{""1367"": ""assembly"", ""1369"": ""grim"", ""1370"": ""ornament"", ""1371"": ""patron"", ""1376"": ""forbid"", ""1378"": ""proclaim"", ""1381"": ""vivid"", ""1384"": ""limestone"", ""1388"": ""comprehension"", ""1389"": ""depression"", ""1390"": ""eternal"", ""1394"": ""specifically"", ""1395"": ""stem"", ""1396"": ""stern""}"
8,6,conversation,"Hey pal, can you summon the courage to slap that prescription request to Dr. Johnson? I know you have contempt for hospitals, but it's just a trifle compared to what might happen if you don't get your meds.",ねぇ、友達、ジョンソン先生に処方箋のリクエストを出す勇気を振り絞れない？病院が嫌いなのはわかるけど、薬をもらわないとどうなるかと比べたら些細なことだよ。,友人同士の会話。一方が病院に行くことを躊躇している友人を説得しようとしている場面。,"{""1368"": ""contempt"", ""1372"": ""prescription"", ""1373"": ""summon"", ""1377"": ""pal"", ""1379"": ""slap"", ""1387"": ""trifle""}"
8,7,free,"As the twilight cast its elastic shadows across the landscape, the farmer prepared to plow the fields one last time before winter. The local currency had lost its value, and garbage littered the streets, but he was determined to fulfill his duty to the land, concealing his worries beneath a sound work ethic.",夕暮れが風景に伸び縮みする影を投げかける中、農夫は冬を前に最後の畑耕しの準備をしていた。地域の通貨は価値を失い、ゴミが通りに散乱していたが、彼は土地に対する義務を果たす決意を固めており、健全な職業倫理の下に自身の心配を隠していた。,,"{""1375"": ""currency"", ""1380"": ""twilight"", ""1382"": ""conceal"", ""1383"": ""elastic"", ""1386"": ""sound"", ""1391"": ""fulfill"", ""1392"": ""garbage"", ""1393"": ""plow""}"
8,8,conversation,"Without your consent, I can't proceed to the next phase of the project.",あなたの同意なしには、プロジェクトの次の段階に進めません。,ビジネス場面での会話。上司と部下、もしくは同僚間のやり取り。,"{""1374"": ""consent"", ""1385"": ""phase""}"
8,9,academic,"Recent archaeological findings have shed new light on ancient civilizations and their incredible technological achievements. In dense urban settlements, researchers discovered sophisticated garment manufacturing facilities and water pump systems, indicating a level of technological advancement that could overtake our previous understanding. Laboratory analysis of these artifacts has led scientists to consult historical guidelines and condense vast amounts of data. The swift progress of these civilizations, despite numerous barriers, allowed them to prosper under challenging conditions. However, their eventual decline might have been hastened by volcanic activity, as evidence suggests nearby volcanoes had a significant impact on their living conditions.",最近の考古学的発見により、古代文明とその驚くべき技術的成果について新たな知見が得られました。密集した都市集落で、研究者たちは高度な衣服製造施設と給水ポンプシステムを発見し、これは私たちの従来の理解を超える技術水準を示しています。これらの遺物の実験室での分析により、科学者たちは歴史的な指針を参照し、膨大なデータを要約することができました。これらの文明は、多くの障壁があったにもかかわらず、急速に発展し、困難な条件下で繁栄しました。しかし、近隣の火山の活動が彼らの生活環境に重大な影響を与えたという証拠が示すように、火山活動によって彼らの最終的な衰退が加速された可能性があります。,,"{""1398"": ""civilization"", ""1399"": ""dense"", ""1400"": ""garment"", ""1401"": ""incredible"", ""1402"": ""overtake"", ""1403"": ""swift"", ""1406"": ""consult"", ""1408"": ""guideline"", ""1410"": ""laboratory"", ""1411"": ""pump"", ""1413"": ""volcano"", ""1415"": ""condense"", ""1416"": ""condition"", ""1420"": ""prosper"", ""1422"": ""barrier""}"
8,10,conversation,"Hey, can we chat real quick? I'm totally exhausted from that brutal workout session. I could barely punch the bag by the end!",ねぇ、ちょっと話せる？そのすごくきついワークアウトで完全に疲れ果てちゃった。最後の方には、もうサンドバッグもろくに殴れなかったよ！,ジムでのワークアウト後の会話,"{""1397"": ""chat"", ""1412"": ""punch"", ""1423"": ""brutal"", ""1425"": ""exhausted""}"
8,11,academic,"The irony of modern technological advancement lies in how it can both diminish and enhance human connections. As we install more sophisticated communication systems, the plain truth becomes evident: while these tools help colonies of digital communities flourish, they may also condemn us to less meaningful face-to-face interactions. Scientists exclaim that this phenomenon requires us to carefully consult experts and establish new guidelines for maintaining healthy social relationships in our glorious but complex digital age.",現代の技術進歩の皮肉は、人々のつながりを減少させると同時に強化もできるという点にあります。より高度なコミュニケーションシステムを導入するにつれて、明白な事実が evident になります：これらのツールはデジタルコミュニティの集団の繁栄を助ける一方で、より意味のある対面でのやり取りを減少させる可能性があります。科学者たちは、この現象に対して専門家に慎重に相談し、輝かしくも複雑なデジタル時代における健全な社会関係を維持するための新しい指針を確立する必要があると主張しています。,,"{""1404"": ""utter"", ""1405"": ""condemn"", ""1406"": ""consult"", ""1407"": ""diminish"", ""1409"": ""install"", ""1417"": ""exclaim"", ""1418"": ""irony"", ""1419"": ""plain"", ""1424"": ""colony"", ""1426"": ""glorious""}"
8,12,free,"The local clothing store began to shrink its inventory as online shopping became more popular. What seemed to annoy customers most was the condition of the remaining garments, which had been condensed into such a small space that many items were wrinkled beyond recognition.",オンラインショッピングが人気を集めるにつれ、地元の衣料品店は在庫を縮小し始めました。顧客を最も悩ませたのは、残っている衣服の状態でした。それらは非常に狭いスペースに詰め込まれたため、多くのアイテムがしわだらけになって元の形が分からないほどでした。,,"{""1414"": ""annoy"", ""1416"": ""condition"", ""1421"": ""shrink""}"
8,13,academic,"The massive transition from traditional to digital learning environments has led to widespread changes in educational routines. While some educators remain reluctant to compromise their earnest teaching methods, the core challenge lies in reproducing effective classroom dynamics in virtual spaces. This unusual situation has sparked inspiration for innovative teaching approaches, though some remain doubtful about their effectiveness. The industrious efforts of teachers to adapt have been met with varying degrees of success, as they gaze into an uncertain future of education.",伝統的な学習環境からデジタル学習環境への大規模な移行により、教育の日常的な方法に広範な変化が生じています。一部の教育者は真摯な教授法を妥協することに消極的ですが、核心的な課題は、仮想空間で効果的な教室の力学を再現することにあります。この異常な状況は革新的な教授法のインスピレーションを引き起こしましたが、その効果については疑問を持つ人々もいます。教師たちの勤勉な適応への努力は、不確実な教育の未来を見つめながら、様々な成功度合いを見せています。,,"{""1427"": ""routine"", ""1429"": ""unusual"", ""1430"": ""compromise"", ""1431"": ""gaze"", ""1434"": ""massive"", ""1438"": ""reproduce"", ""1439"": ""transition"", ""1441"": ""doubtful"", ""1442"": ""earnest"", ""1443"": ""industrious"", ""1444"": ""inspiration"", ""1446"": ""reluctant"", ""1448"": ""core"", ""1453"": ""widespread""}"
8,14,conversation,"Hey, I'm getting desperate about this deadline! Do you have any clue how to handle this awkward situation with the client?",ねえ、この締切のことで必死になってるんだ！クライアントとのこの気まずい状況をどう扱えばいいか、何かヒントある？,オフィスでの同僚との会話,"{""1447"": ""clue"", ""1449"": ""deadline"", ""1450"": ""desperate"", ""1455"": ""awkward""}"
8,15,free,"The invasion of privacy concerns led authorities to prohibit certain data collection practices. The refusal to cease these activities implied a deeper problem, causing many users to retreat from social media platforms. As they sprinkle their personal information across various platforms, users face the agony of potential data breaches.",プライバシー侵害への懸念により、当局は特定のデータ収集慣行を禁止することになりました。これらの活動を中止することを拒否したことは、より深刻な問題を示唆し、多くのユーザーがソーシャルメディアプラットフォームから撤退する原因となりました。個人情報を様々なプラットフォームに散りばめる中で、ユーザーは潜在的なデータ漏洩の苦痛に直面しています。,,"{""1428"": ""sprinkle"", ""1433"": ""invasion"", ""1436"": ""prohibit"", ""1437"": ""refusal"", ""1451"": ""imply"", ""1452"": ""retreat"", ""1454"": ""agony"", ""1456"": ""cease""}"
8,16,academic,"Recent studies suggest that consumer preferences have undergone an absurd shift, with many customers showing an increasing tendency to invade their own privacy through social media. Each piece of personal information shared becomes a potential vulnerability, as malicious actors seek to exploit these digital footprints.",最近の研究によると、消費者の嗜好は不条理な変化を遂げており、多くの顧客がソーシャルメディアを通じて自身のプライバシーを侵害する傾向が高まっています。共有される個人情報の一つ一つが潜在的な脆弱性となり、悪意のある行為者がこれらのデジタルフットプリントを悪用しようとしています。,,"{""1432"": ""invade"", ""1435"": ""piece"", ""1440"": ""absurd"", ""1445"": ""preference""}"
8,17,academic,"Recent studies derive significant insights into how immigrants react to social disorder in urban environments. Research indicates that influential community leaders who cultivate positive relationships can help relieve the distress often experienced by newcomers. While some immigrants may initially seek solitude as they modify their lifestyle to adapt, those who register for community programs and maintain a flexible mindset tend to be more optimistic about their integration. This phenomenon has led researchers to anticipate new patterns of social adaptation, particularly in communities where diligent support networks have been established.",最近の研究では、移民が都市環境における社会的混乱にどのように反応するかについて重要な知見が得られています。影響力のあるコミュニティリーダーが良好な関係を育むことで、新規参入者がしばしば経験する苦痛を和らげることができることが示されています。移民の中には、最初は生活様式を変更して適応する際に孤独を求める人もいますが、コミュニティプログラムに登録し、柔軟な考え方を維持する人々は、統合についてより楽観的な傾向があります。この現象は、特に勤勉なサポートネットワークが確立されているコミュニティにおいて、研究者たちに新たな社会適応パターンを予見させることとなっています。,,"{""1457"": ""derive"", ""1458"": ""disorder"", ""1459"": ""influential"", ""1462"": ""anticipate"", ""1463"": ""cultivate"", ""1464"": ""distress"", ""1465"": ""modify"", ""1467"": ""register"", ""1468"": ""relieve"", ""1469"": ""solitude"", ""1474"": ""flexible"", ""1475"": ""optimistic"", ""1477"": ""react"", ""1481"": ""diligent"", ""1482"": ""immigrant""}"
8,18,conversation,"Hey, can you fetch my assignment from the barn? I need to trim those photos and shed some unnecessary details before I submit it.",ねぇ、納屋から私の課題を取ってきてくれない？提出前に写真を切り取って、不要な詳細を削除する必要があるの。,大学生同士の会話。課題の締め切りが迫っている状況。,"{""1461"": ""trim"", ""1471"": ""assignment"", ""1472"": ""barn"", ""1473"": ""fetch"", ""1478"": ""shed""}"
8,19,free,"The courageous activist refused to resign despite the disgust she felt towards those who despise change. Using circular reasoning and random arguments, her opponents tried to maintain their somber grip on outdated policies, but she persisted, refusing to be deterred by their pessimistic outlook.",勇敢な活動家は、変化を軽蔑する人々に対する嫌悪感を感じながらも、辞任することを拒否しました。反対派は循環論法と無作為な議論を用いて時代遅れの政策への陰鬱な支配を維持しようとしましたが、彼女は悲観的な見通しに怯むことなく、断固として立ち向かい続けました。,,"{""1466"": ""random"", ""1470"": ""somber"", ""1476"": ""pessimistic"", ""1479"": ""courageous"", ""1480"": ""despise"", ""1484"": ""resign"", ""1485"": ""circular"", ""1486"": ""disgust""}"
8,20,free,"The old woman used a rag to clean the windows of her small house, which she had come to inhabit after years of wandering. Despite her humble circumstances, she maintained a sense of dignity, carefully preserving even the most worn items.",老女は長年の放浪の末に住むようになった小さな家の窓を、ぼろ切れで掃除していました。つましい環境にもかかわらず、彼女は尊厳の感覚を保ち、最も擦り切れた品物でさえ大切に保存していました。,,"{""1460"": ""inhabit"", ""1483"": ""rag""}"
8,21,academic,"Recent studies on marine organisms have revealed how excessive human activities impact oceanic ecosystems. Scientists have implemented various conservation measures to revive endangered species, but many nations continue to abandon their environmental responsibilities. The mission to protect marine biodiversity becomes increasingly crucial as climate change causes vapor from warming oceans to alter weather patterns globally. Research shows that when we confine marine species to smaller habitats due to pollution and development, entire ecosystems stumble and may collapse.",海洋生物に関する最近の研究により、過度な人間活動が海洋生態系にどのような影響を与えているかが明らかになっています。科学者たちは絶滅危惧種を復活させるためにさまざまな保護対策を実施していますが、多くの国々は依然として環境に対する責任を放棄し続けています。海洋の温暖化による水蒸気が世界的な気象パターンを変化させる中、海洋生物多様性を保護するという使命はますます重要になっています。研究によると、汚染や開発により海洋生物の生息地が制限されると、生態系全体が躓き、崩壊する可能性があることが示されています。,環境科学に関する学術的な文章,"{""1487"": ""excessive"", ""1488"": ""mission"", ""1489"": ""organism"", ""1490"": ""revive"", ""1491"": ""stumble"", ""1492"": ""abandon"", ""1493"": ""confine"", ""1494"": ""implement"", ""1496"": ""vapor""}"
8,22,conversation,"Hey, I totally stumbled across your old messages. Did you really abandon that mission to revive the school newspaper?",ねえ、偶然あなたの古いメッセージを見つけたんだけど。本当に学校新聞を復活させるっていう計画を諦めちゃったの？,友人同士のカジュアルなSNSメッセージ,"{""1488"": ""mission"", ""1490"": ""revive"", ""1491"": ""stumble"", ""1492"": ""abandon""}"
8,23,free,"After years of excessive drinking, John finally decided to repent and turn his life around. He knew he couldn't confine his recovery to just attending meetings - he needed to implement a complete lifestyle change. The vapor from his last drink still lingered in his memory as he made this life-changing decision.",長年の過度な飲酒の後、ジョンはついに悔い改めて人生を立て直すことを決意しました。彼は、単にミーティングに参加するだけに回復を限定することはできないと知っていました - 完全な生活様式の変更を実施する必要がありました。最後の一杯の蒸気は、この人生を変える決断を下した時も、まだ彼の記憶に残っていました。,個人の更生に関する物語風の文章,"{""1487"": ""excessive"", ""1493"": ""confine"", ""1494"": ""implement"", ""1495"": ""repent"", ""1496"": ""vapor""}"
8,24,academic,"The study of microscopic organisms has revealed how these tiny life forms can survive in confined spaces with minimal resources. Scientists have implemented new research protocols to understand how these organisms might revive themselves after periods of dormancy, particularly in extreme environments where vapor content fluctuates dramatically. This mission has proven crucial for understanding potential extraterrestrial life.",微生物の研究により、これらの微小な生命体が最小限の資源で限られた空間でどのように生存できるかが明らかになっています。科学者たちは、特に水蒸気含有量が劇的に変動する極限環境において、これらの生物が休眠期間後にどのように自己を再生させるかを理解するために、新しい研究プロトコルを実施しています。この使命は、地球外生命の可能性を理解する上で極めて重要であることが証明されています。,微生物学に関する学術的な文章,"{""1488"": ""mission"", ""1489"": ""organism"", ""1490"": ""revive"", ""1493"": ""confine"", ""1494"": ""implement"", ""1496"": ""vapor""}"
