group_id,sentence_id,sentence_type,sentence_content_en,translated_sentence,note,words_contained_dict
23,1,academic,"Recent advances in medical imaging have revolutionized our understanding of human anatomy, particularly in studying the relationship between the spine and its surrounding tissues. The vertebrae, which protect the spinal nerve tissue, work in conjunction with muscles from the neck down through the waist. This complex system supports the head and enables movement of the shoulders, arms, and upper body. Research has shown that poor posture can affect everything from the skull to the buttocks, potentially causing compression in the abdomen and strain on the lower back. Modern imaging techniques can now detail how misalignment of the spine can impact various body parts, from the forehead to the thighs, providing crucial insights for therapeutic interventions.",最近の医療画像技術の進歩により、人体解剖学の理解、特に脊椎とその周囲組織の関係についての理解が革新的に進みました。脊髄神経組織を保護する脊椎は、首から腰にかけての筋肉と協調して働きます。この複雑なシステムは頭部を支え、肩、腕、上半身の動きを可能にします。研究によると、悪い姿勢は頭蓋骨から臀部まですべてに影響を与え、腹部の圧迫や腰部への負担を引き起こす可能性があります。現代の画像技術により、脊椎の位置のずれが額から太もまでの様々な体の部分にどのように影響するかを詳細に把握できるようになり、治療介入に重要な洞察を提供しています。,,"{""3550"": ""arm"", ""3552"": ""forehead"", ""3553"": ""head"", ""3554"": ""neck"", ""3555"": ""nerve"", ""3556"": ""shoulder"", ""3557"": ""skull"", ""3559"": ""tissue"", ""3560"": ""abdomen"", ""3561"": ""back"", ""3563"": ""buttock"", ""3570"": ""spine"", ""3571"": ""thigh"", ""3572"": ""vertebrae"", ""3573"": ""waist""}"
23,2,conversation,"OMG, I totally pulled a muscle in my elbow and wrist during yoga! My whole hand is killing me, and my fingers are so stiff I can barely text!",もう、ヨガで肘と手首の筋肉を完全に痛めちゃった！手全体が痛くて、指が固まってて、やっとテキストが打てるくらい！,若い女性がSNSや友人へのメッセージで使用するような口調です。,"{""3564"": ""elbow"", ""3565"": ""finger"", ""3566"": ""hand"", ""3574"": ""wrist""}"
23,3,academic,"The human body's cardiovascular system demonstrates remarkable integration between the heart and other vital organs. Blood vessels extend from the heart through the breast tissue and throughout the body, with the kidneys playing a crucial role in blood pressure regulation. The complex network of nerves and blood vessels ensures that even distant parts of the body, from the face to the heel and ankle, receive adequate blood supply. This intricate system maintains homeostasis while supporting various physical activities, from simple movements of the hip to complex athletic performances involving the knee and leg muscles.",人体の心血管系は、心臓と他の重要な器官との間の驚くべき統合を示しています。血管は心臓から乳房組織を通って体全体に広がり、腎臓は血圧調節において重要な役割を果たしています。神経と血管の複雑なネットワークにより、顔から踵や足首といった体の離れた部分まで、適切な血液供給が確保されています。この精巧なシステムは、腰から単純な動きから、膝や脚の筋肉を使う複雑な運動能力まで、様々な身体活動をサポートしながら恒常性を維持しています。,,"{""3551"": ""face"", ""3559"": ""tissue"", ""3562"": ""breast"", ""3567"": ""hip"", ""3568"": ""leg"", ""3575"": ""ankle"", ""3576"": ""heart"", ""3577"": ""heel"", ""3578"": ""kidney"", ""3579"": ""knee""}"
23,4,conversation,"Hey, can you grab my phone from the palm of my hand? I can't move my arm 'cause I just got this weird nerve pain in my shoulder.",ねぇ、私の手のひらからスマホ取ってくれない？肩に変な神経痛があって腕が動かせないんだ。,友人同士の会話での表現です。,"{""3550"": ""arm"", ""3555"": ""nerve"", ""3556"": ""shoulder"", ""3566"": ""hand"", ""3569"": ""palm""}"
23,5,free,"The massage therapist focused on the client's throat and neck area, carefully working down through the tissue of the upper back. She noticed tension in the vertebrae near the shoulder blades, likely caused by poor posture at work.",マッサージセラピストは、クライアントの喉と首の領域に焦点を当て、上背部の組織をていねいにほぐしていきました。肩甲骨付近の脊椎に緊張があることに気づき、それはおそらく仕事での悪い姿勢が原因でした。,,"{""3554"": ""neck"", ""3556"": ""shoulder"", ""3558"": ""throat"", ""3559"": ""tissue"", ""3561"": ""back"", ""3572"": ""vertebrae""}"
23,6,academic,"Recent studies in sports medicine have highlighted the complex interplay between ligaments, tendons, and cartilage in athletic performance. When athletes experience dehydration during intense training, they become more susceptible to injuries such as sprains and shin splints. The research also demonstrates how proper breathing techniques, involving controlled inhale and exhale patterns, can significantly impact performance. Athletes who experience jet lag often report increased instances of muscle cramps and dizziness, particularly affecting their lower extremities including the toe joints.",スポーツ医学における最近の研究では、運動能力における靭帯、腱、軟骨の複雑な相互作用が注目されています。アスリートが激しいトレーニング中に脱水症状を経験すると、捻挫や脛の痛みなどの怪我を負いやすくなります。また、研究では、吸気と呼気のパターンを制御する適切な呼吸法が、パフォーマンスに大きな影響を与えることも示されています。時差ぼけを経験するアスリートは、特に足の指の関節を含む下肢に影響を及ぼす筋肉の痙攣やめまいの発生が増加すると報告しています。,スポーツ医学に関する学術的な文章,"{""3580"": ""ligament"", ""3583"": ""shin"", ""3585"": ""toe"", ""3586"": ""cartilage"", ""3589"": ""exhale"", ""3590"": ""inhale"", ""3593"": ""tendon"", ""3595"": ""cramp"", ""3596"": ""dehydration"", ""3607"": ""dizziness"", ""3608"": ""jet lag"", ""3609"": ""sprain""}"
23,7,academic,"The human digestive system, comprising vital organs such as the liver and stomach, plays a crucial role in digestion and overall health. Common gastrointestinal issues include constipation, nausea, and vomiting, which can be exacerbated by poor dietary choices. The lungs, while not directly involved in digestion, work in concert with other organs to maintain homeostasis. Recent medical literature has documented increasing cases of patients presenting with concurrent symptoms of stomachache and congestion, particularly during seasonal transitions.",肝臓や胃などの重要な器官で構成される人体の消化器系は、消化と全体的な健康に重要な役割を果たします。一般的な消化器系の問題には便秘、吐き気、嘔吐があり、これらは不適切な食事選択によって悪化する可能性があります。肺は消化に直接関与していませんが、他の器官と協調して恒常性を維持します。最近の医学文献では、特に季節の変わり目に、胃痛と鼻づまりの症状を同時に示す患者の症例が増加していることが報告されています。,人体の消化器系に関する学術的な文章,"{""3581"": ""liver"", ""3582"": ""lungs"", ""3584"": ""stomach"", ""3588"": ""digestion"", ""3594"": ""constipation"", ""3599"": ""nausea"", ""3601"": ""stomachache"", ""3603"": ""vomiting"", ""3605"": ""congestion""}"
23,8,conversation,"Hey, I can't make it to the gym today. Got this nasty cough and I'm super itchy from this weird rash I got after trying that new detergent.",ねぇ、今日ジムに行けないんだ。ひどい咳が出てて、新しい洗剤を使ってから変な発疹が出てすごく痒いんだ。,友人へのカジュアルなメッセージ,"{""3587"": ""cough"", ""3598"": ""itchy"", ""3600"": ""rash""}"
23,9,conversation,"Dude, you snore so loud when you're tired! And you were sweating like crazy during your nap.",おい、疲れてる時のいびきすごく大きいぞ！それに昼寝の時めちゃくちゃ汗かいてたよ。,ルームメイトや友人との会話,"{""3591"": ""snore"", ""3592"": ""sweat""}"
23,10,free,"After falling during his morning jog, Tom noticed an abrasion on his knee and a small cut on his hand. His headache from earlier that morning had gotten worse, and his toothache was still bothering him. He decided it was time to visit the doctor.",朝のジョギング中に転んだ後、トムは膝に擦り傷と手に小さな切り傷があることに気付きました。その朝早くからの頭痛は悪化し、歯痛もまだ続いていました。医者に行く時期だと判断しました。,日常生活での怪我や体調不良の描写,"{""3597"": ""headache"", ""3602"": ""toothache"", ""3604"": ""abrasion"", ""3606"": ""cut""}"
23,11,academic,"Recent studies on infectious diseases have highlighted the complex relationship between microbes, viruses, and the human immune system. When pathogens enter the body, white blood cells produce antibodies to combat the infection. However, in cases of highly contagious and transmissible diseases, such as the recent epidemic, strict quarantine measures become necessary. The exposure to certain pathogens can lead to various conditions, from mild symptoms like bronchitis to more severe complications like pneumonia. Medical researchers have observed that patients with underlying conditions such as diabetes or asthma are particularly vulnerable to these infections.",感染症に関する最近の研究では、微生物、ウイルス、人体の免疫システムの間の複雑な関係が明らかになっています。病原体が体内に入ると、白血球は感染と戦うために抗体を産生します。しかし、最近の流行病のような非常に感染力が強く伝染性の高い病気の場合、厳格な検疫措置が必要となります。特定の病原体への曝露は、気管支炎のような軽度の症状から肺炎のようなより深刻な合併症まで、様々な状態を引き起こす可能性があります。医学研究者は、糖尿病や喘息などの基礎疾患を持つ患者が、これらの感染症に特に脆弱であることを観察しています。,,"{""3613"": ""contagious"", ""3615"": ""epidemic"", ""3616"": ""exposure"", ""3618"": ""infectious"", ""3619"": ""quarantine"", ""3620"": ""transmissible"", ""3622"": ""asthma"", ""3623"": ""bronchitis"", ""3625"": ""diabetes"", ""3629"": ""pneumonia"", ""3635"": ""antibody"", ""3636"": ""infection"", ""3637"": ""microbe"", ""3638"": ""virus"", ""3639"": ""white blood cell""}"
23,12,conversation,"Hey, I had to cancel our meetup today. I've come down with the flu and my hay fever is acting up too. The doctor says it might be combined with a sinus infection.",ごめん、今日の待ち合わせキャンセルしなきゃならない。インフルエンザにかかっちゃって、花粉症も出てきたんだ。医者が副鼻腔炎も併発してるかもしれないって。,友人との予定をキャンセルする際のメッセージ,"{""3611"": ""combine"", ""3612"": ""come down with"", ""3624"": ""cancel"", ""3627"": ""flu"", ""3628"": ""hay fever"", ""3630"": ""sinus infection"", ""3636"": ""infection""}"
23,13,free,"The patient was admitted with multiple injuries: a wound to the chest, a fracture in the left arm, and a shoulder dislocation. During examination, doctors also discovered an ulcer and a small tumor that required further investigation. The patient's history revealed tuberculosis treatment from five years ago.",患者は複数の怪我で入院しました：胸部の傷、左腕の骨折、そして肩の脱臼です。検査中、医師たちは更なる調査が必要な潰瘍と小さな腫瘍も発見しました。患者の病歴から、5年前に結核の治療を受けていたことが判明しました。,,"{""3610"": ""wound"", ""3614"": ""dislocation"", ""3617"": ""fracture"", ""3631"": ""tuberculosis"", ""3632"": ""tumor"", ""3633"": ""ulcer""}"
23,14,free,"The rehabilitation center specializes in treating various conditions, from addiction to chronic diarrhea. Their holistic approach helps patients manage both physical symptoms and psychological aspects of their conditions, particularly for those with severe allergies requiring long-term care.",このリハビリテーションセンターは、依存症から慢性下痢まで、様々な症状の治療を専門としています。彼らの全人的アプローチは、特に長期的なケアを必要とする重度のアレルギーを持つ患者など、身体的症状と心理的側面の両方の管理を支援します。,,"{""3621"": ""allergy"", ""3626"": ""diarrhea"", ""3634"": ""addiction""}"
23,15,academic,"Recent advances in medical technology have revolutionized how specialists and surgeons approach transplantation procedures. Modern clinics now employ sophisticated monitoring systems to track patients' vital signs, including heart rate, blood pressure, and pulse during surgery. Post-operative care has also evolved, with nurses providing specialized care and therapists assisting in rehabilitation. The success rate of organ transplants has significantly improved due to new antibiotics and medications that prevent rejection, while outpatient follow-up protocols ensure proper convalescence.",最近の医療技術の進歩により、専門医や外科医が臓器移植手術にアプローチする方法が革新的に変化しました。現代の医療機関では、手術中の心拍数、血圧、脈拍などの生体信号を追跡する高度なモニタリングシステムを採用しています。術後ケアも進化し、看護師が専門的なケアを提供し、セラピストがリハビリテーションを支援しています。拒絶反応を防ぐ新しい抗生物質や薬剤により臓器移植の成功率が大幅に向上し、外来患者のフォローアッププロトコルにより適切な回復が確保されています。,,"{""3640"": ""antibiotic"", ""3642"": ""nurse"", ""3643"": ""specialist"", ""3644"": ""surgeon"", ""3645"": ""therapist"", ""3646"": ""blood pressure"", ""3652"": ""heart rate"", ""3655"": ""pulse"", ""3660"": ""convalesce"", ""3663"": ""medication"", ""3665"": ""outpatient"", ""3669"": ""transplantation""}"
23,16,conversation,"Hey, I need to fill a prescription for this ointment the doctor gave me for my rash. Do you know if the clinic near campus is still open?",ねぇ、医者にもらった発疹用の軟膏の処方箋を出さないといけないんだけど。キャンパス近くのクリニックはまだ開いてるか知ってる？,大学生同士の会話,"{""3648"": ""clinic"", ""3650"": ""fill a prescription"", ""3653"": ""ointment""}"
23,17,free,"After experiencing severe chest pain, John was rushed to the emergency room where doctors diagnosed him with a heart attack. His symptoms included high temperature and irregular pulse. The medical team immediately began treatment with aspirin and other medications, while carefully monitoring his vital signs.",激しい胸痛を経験した後、ジョンは救急室に搬送され、医師は心臓発作と診断しました。症状には高熱と不規則な脈拍が含まれていました。医療チームは直ちにアスピリンやその他の薬剤による治療を開始し、バイタルサインを慎重にモニタリングしました。,,"{""3641"": ""aspirin"", ""3649"": ""diagnose"", ""3651"": ""heart attack"", ""3655"": ""pulse"", ""3657"": ""symptom"", ""3658"": ""treat"", ""3668"": ""temperature""}"
23,18,academic,"The rising prevalence of obesity in developed nations has led to increased demand for physical examinations and regular check-ups. Healthcare providers now emphasize preventive care, requiring patients to undergo comprehensive health assessments. When necessary, doctors provide referrals to specialists who can administer appropriate injections or shots for various conditions. The integration of bandage application techniques and wound care management has also become a standard part of medical training.",先進国における肥満の有病率の上昇により、健康診断と定期検査の需要が増加しています。医療提供者は現在、予防医療を重視し、患者に包括的な健康評価を受けることを求めています。必要に応合わせて、医師は様々な状態に対して適切な注射を施すことができる専門医への紹介状を提供します。包帯の適用技術と創傷ケア管理も、医療訓練の標準的な部分となっています。,,"{""3647"": ""check-up"", ""3654"": ""physical examination"", ""3656"": ""referral"", ""3659"": ""bandage"", ""3662"": ""injection"", ""3664"": ""obesity"", ""3666"": ""patient"", ""3667"": ""shot""}"
23,19,free,"The new experimental treatment has shown promising results in helping to cure various chronic conditions. Patients who previously relied solely on traditional medications are now finding relief through this innovative approach, which combines both conventional and alternative therapies.",新しい実験的治療法は、様々な慢性疾患の治療に有望な結果を示しています。以前は従来の薬物療法のみに頼っていた患者たちが、従来型と代替療法を組み合わせたこの革新的なアプローチによって症状の改善を実感しています。,,"{""3661"": ""cure""}"
23,20,academic,"Recent studies in space exploration have revolutionized our understanding of the Solar System. From Mercury's extreme temperatures to Venus's dense atmosphere, from Mars's potential for human colonization to the gas giants Saturn, Uranus, and Neptune, each planet presents unique characteristics. Beyond our planetary neighbors, interstellar clouds and black holes continue to intrigue astronomers. The cosmos, with its countless galaxies and constellations, remains a frontier for scientific discovery. Recent observations of comets passing through our system have provided valuable data about the formation of celestial bodies.",宇宙探査における最近の研究は、太陽系に関する我々の理解を革新的に変えました。水星の極端な温度から金星の濃密な大気まで、火星の人類居住の可能性から気体惑星である土星、天王星、海王星に至るまで、各惑星は独特の特徴を示しています。惑星の隣人を超えて、星間雲やブラックホールは天文学者を魅了し続けています。無数の銀河や星座を持つ宇宙は、科学的発見のフロンティアであり続けています。最近の彗星の太陽系通過の観測により、天体の形成に関する貴重なデータが得られています。,天文学的な専門用語を多く含む学術的な文章です。,"{""3683"": ""Earth"", ""3685"": ""Mars"", ""3686"": ""Mercury"", ""3688"": ""Neptune"", ""3690"": ""Saturn"", ""3691"": ""Solar System"", ""3692"": ""Uranus"", ""3693"": ""Venus"", ""3694"": ""black hole"", ""3695"": ""comet"", ""3696"": ""constellation"", ""3697"": ""cosmos"", ""3698"": ""galaxy"", ""3699"": ""interstellar cloud""}"
23,21,academic,"The relationship between aerobic activity and calorie intake plays a crucial role in weight management. Studies show that individuals who maintain regular aerobic exercise while monitoring their caloric intake are more likely to lose weight effectively. Additionally, proper hygiene and sanitary conditions, combined with regular immunization and vaccination programs, help build a resistant immune system. Modern medical research has revealed that some health conditions are hereditary, linked to specific chromosomes, while others may be congenital, present from birth.",有酸素運動とカロリー摂取の関係は、体重管理において重要な役割を果たします。定期的な有酸素運動を維持しながらカロリー摂取を監視する個人は、より効果的に体重を減らす可能性が高いことが研究で示されています。さらに、適切な衛生状態と清潔な環境に加え、定期的な予防接種とワクチン接種プログラムは、抵抗力のある免疫システムの構築を助けます。現代の医学研究により、一部の健康状態は特定の染色体に関連する遺伝性のものである一方、他は先天性で出生時から存在することが明らかになっています。,健康科学に関する学術的な文章です。,"{""3670"": ""aerobic activity"", ""3671"": ""calorie"", ""3672"": ""hygiene"", ""3673"": ""immunization"", ""3675"": ""intake"", ""3676"": ""lose weight"", ""3677"": ""resistant"", ""3678"": ""sanitary"", ""3679"": ""vaccination"", ""3680"": ""chromosome"", ""3681"": ""congenital"", ""3682"": ""hereditary""}"
23,22,conversation,"Hey, did you see that lunar eclipse last night? The Moon looked absolutely incredible! I stayed up late just to watch it.",ねえ、昨夜の月食見た？月が本当に信じられないくらい綺麗だったよ！わざわざ夜更かしして見てたんだ。,友人同士の casual な会話です。,"{""3684"": ""lunar"", ""3687"": ""Moon""}"
23,23,conversation,"I heard Pluto isn't considered a planet anymore. That's kind of sad, isn't it? I remember learning about it in elementary school.",冥王星はもう惑星として扱われてないんだって。ちょっと寂しいよね？小学校で習ったの覚えてるよ。,学校での思い出話をする友人同士の会話です。,"{""3689"": ""Pluto""}"
23,24,conversation,"After this inoculation, you might feel a bit under the weather, but it's totally normal. Just take it easy for a day or two.",この予防接種の後は少し体調が悪くなるかもしれないけど、全く普通のことよ。1、2日はゆっくり休んでね。,医療従事者から患者への説明です。,"{""3674"": ""inoculation""}"
23,25,conversation,I need to watch my intake of junk food. My doctor says I should focus more on balanced nutrition.,ジャンクフードの摂取量を気をつけないとな。医者からもっとバランスの取れた栄養に気を付けるように言われたんだ。,健康に関する友人との会話です。,"{""3675"": ""intake""}"
23,26,academic,"Recent astronomical observations have revealed fascinating connections between quasars and the evolution of the universe. These incredibly bright cosmic objects, powered by supermassive black holes, serve as beacons that allow scientists to study the early stages of cosmic development. Within our own galaxy, the Milky Way, researchers have identified numerous stellar formations, including spectacular nebulae that serve as stellar nurseries. These discoveries have enhanced our understanding of how star systems form and evolve within larger super clusters, providing crucial insights into the fundamental structure of cosmic architecture.",最近の天文学的観測により、クエーサーと宇宙の進化の間の興味深い関連性が明らかになりました。超大質量ブラックホールによって動力を得るこれらの信じられないほど明るい宇宙物体は、科学者が宇宙発展の初期段階を研究することを可能にする道標として機能しています。私たちの銀河系である天の川銀河内では、研究者たちが星の揺りかごとして機能する壮観な星雲を含む、数多くの恒星形成を特定しています。これらの発見により、超銀河団内での恒星系の形成と進化についての理解が深まり、宇宙の構造の基本的な仕組みについて重要な洞察が得られています。,天文学の専門的な内容を含む学術的な文章,"{""3700"": ""nebula"", ""3701"": ""quasar"", ""3702"": ""star"", ""3703"": ""super cluster"", ""3704"": ""the Milky Way"", ""3705"": ""universe""}"
23,27,conversation,"Hey, did you see that documentary about the Milky Way last night? The shots of those nebulae were absolutely mind-blowing!",ねぇ、昨日の天の川についてのドキュメンタリー見た？あの星雲の映像が本当に衝撃的だったよ！,友人同士の casual な会話。科学ドキュメンタリーについての感想,"{""3700"": ""nebula"", ""3704"": ""the Milky Way""}"
